### ISSUE TITLE
tpws TLS Record Fragmentation неэффективная. 

### ISSUE THREAD

**Issue by samvova** [bol-van/zapret#238]
### Описание проблемы
запускаем tpws с помощью команды
`/tpws --bind-addr 192.168.31.65 --port 1081 --socks  --tlsrec-pos=1`
параметры используются также следующие :
--tlsrec=sni|sniext
--tlsrec-pos=<pos>

Видим по логам Wireshark, что фрагменты разбиваются согласно [6.2.1](https://www.rfc-editor.org/rfc/rfc5246#section-6.2.1).  Fragmentation
В этом случае фрагменты отправляются в одном пакете и DPI легко собирает фрагменты в один запрос и распознает нежелательный SNI.  Внизу дамп Wireshark.

При этом работающее решение (GBDPI) разбивает Client Hello на разные сегменты TCP. Это другая технология - TCP Fragmentation
Разницу в технологиях можно посмотреть [здесь ](https://upb-syssec.github.io/blog/2023/record-fragmentation/)

**TCP Fragmentation** _(так реализовано в другом решении)_
![TCP Fragmentation](https://upb-syssec.github.io/assets/img/2023/06/record-frag/tcp_frag-dark.svg)

**TLS Record Fragmentation** _(так реализовано в tpws)_
![TLS Record Fragmentation](https://upb-syssec.github.io/assets/img/2023/06/record-frag/record_frag-dark.svg)

### Предложение по реализации
Необходимо  либо добавить опцию TCP Fragmentation, либо исправить текущую реализацию фрагментации, т.к. она неэффективная. 

___
Как выглядит фрагментация сейчас
```
Frame 53: 270 bytes on wire (2160 bits), 270 bytes captured (2160 bits)
Ethernet II, Src: 02:df:e1:a3:30:dc (02:df:e1:a3:30:dc), Dst: XiaomiCommun_8d:a0:d0 (f0:b4:29:8d:a0:d0)
Internet Protocol Version 4, Src: 192.168.31.65 (192.168.31.65), Dst: rr4.sn-5goeenez.googlevideo.com (74.125.111.9)
Transmission Control Protocol, Src Port: 44360, Dst Port: 443, Seq: 1, Ack: 1, Len: 204
Transport Layer Security
    TLSv1 Record Layer: Handshake Protocol: Client Hello (fragment)
        Content Type: Handshake (22)
        Version: TLS 1.0 (0x0301)
        Length: 83
        Handshake Protocol: Client Hello (fragment)
        Reassembled Handshake Message in frame: 53
    TLSv1 Record Layer: Handshake Protocol: Client Hello
        Content Type: Handshake (22)
        Version: TLS 1.0 (0x0301)
        Length: 111
        Handshake Protocol: Client Hello (last fragment)
        [2 Reassembled Handshake Fragments (194 bytes): #53(83), #53(111)]
        Handshake Protocol: Client Hello
            Handshake Type: Client Hello (1)
            Length: 190
            Version: TLS 1.2 (0x0303)
            Random: 371c1f9b43db26e6f4288c1cebd01b6e2256d14b4b0a93f0edf42077611926e3
            Session ID Length: 0
            Cipher Suites Length: 28
            Cipher Suites (14 suites)
            Compression Methods Length: 1
            Compression Methods (1 method)
            Extensions Length: 121
            Extension: renegotiation_info (len=1)
            Extension: server_name (len=38) name=rr4---sn-5goeenez.googlevideo.com
            Extension: extended_master_secret (len=0)
            Extension: session_ticket (len=0)
            Extension: signature_algorithms (len=20)
            Extension: status_request (len=5)
            Extension: application_layer_protocol_negotiation (len=11)
            Extension: ec_point_formats (len=2)
            Extension: supported_groups (len=8)
            [JA4: t12d1409h1_c866b44c5a26_b39be8c56a14]
            [JA4_r: t12d1409h1_002f,0035,009c,009d,c009,c00a,c013,c014,c02b,c02c,c02f,c030,cca8,cca9_0005,000a,000b,000d,0017,0023,ff01_0403,0804,0401,0503,0805,0501,0806,0601,0201]
            [JA3 Fullstring: 771,49195-49196-52393-49199-49200-52392-49161-49162-49171-49172-156-157-47-53,65281-0-23-35-13-5-16-11-10,29-23-24,0]
            [JA3: d8c87b9bfde38897979e41242626c2f3]

```

**Comment by bol-van** [comment]
вы не разобрались
tlsrec это одно,  сплит это другое
их можно сочетать
но имейте в виду, что тспу в России может сечь ответ сервера
поэтому тлс 1.2 может не пробиться

**Comment by samvova** [comment]
поставил --split-pos=2. Client Hello не фрагментируется. в чем проблема?

**Comment by bol-van** [comment]
тцпдампу надо указывать -i  интерфейс внешней сети
и еще раскройте дерево
шарк может обьединять сегменты
и писать внутри об этом
