### ISSUE TITLE
После обновления до 69.9 перестал открываться ютуб на самсунговских телевизорах

### ISSUE THREAD

**Issue by Dager26reg** [bol-van/zapret#1043]
Собственно до обновления интерфейс ютуба открывался на теликах, но после обновления до 69.9 на самсунгах через встроенный клиент ютуба перестал, варешарп показал что от телека идет запрос: 
364	12.314700	192.168.1.143	64.233.165.198	TLSv1	272	Client Hello (SNI=www.youtube.com)

Transport Layer Security
    TLSv1 Record Layer: Handshake Protocol: Client Hello
        Content Type: Handshake (22)
        Version: TLS 1.0 (0x0301)
        Length: 201
        Handshake Protocol: Client Hello
            Handshake Type: Client Hello (1)
            Length: 197
            Version: TLS 1.2 (0x0303)
            Random: 05932f382e47308921db3194d34ce43628e4ed9d4ef470caa95c40f567e27d50
            Session ID Length: 0
            Cipher Suites Length: 28
            Cipher Suites (14 suites)
            Compression Methods Length: 1
            Compression Methods (1 method)
            Extensions Length: 128
            Extension: Reserved (GREASE) (len=0)
            Extension: renegotiation_info (len=1)
            Extension: server_name (len=20) name=www.youtube.com
            Extension: extended_master_secret (len=0)
            Extension: session_ticket (len=0)
            Extension: signature_algorithms (len=20)
            Extension: status_request (len=5)
            Extension: signed_certificate_timestamp (len=0)
            Extension: application_layer_protocol_negotiation (len=14)
            Extension: ec_point_formats (len=2)
            Extension: supported_groups (len=10)
            Extension: compress_certificate (len=3)
            Extension: Reserved (GREASE) (len=1)
Затем идет 
365	12.314935	64.233.165.198	192.168.1.143	TCP	66	443 → 54393 [ACK] Seq=1 Ack=207 Win=30016 Len=0 TSval=18871 TSecr=557125
На что телек отвечает FIN,ASK и тишина.
Я правильно понимаю что nfqws не понимает протокол TLS 1.0? Из-за этого перестало работать соединение на старом протоколе? Или тут причина в чем-то другом? И почему на прошлых версиях работало? Что изменилось?
Как пофиксить проблему?

**Comment by Dager26reg** [comment]
361	12.307502	192.168.1.143	64.233.165.198	TCP	74	54393 → 443 [SYN] Seq=0 Win=29200 Len=0 MSS=1460 SACK_PERM TSval=557124 TSecr=0 WS=128
362	12.307885	64.233.165.198	192.168.1.143	TCP	74	443 → 54393 [SYN, ACK] Seq=0 Ack=1 Win=28960 Len=0 MSS=1460 SACK_PERM TSval=18869 TSecr=557124 WS=1
363	12.309280	192.168.1.143	64.233.165.198	TCP	66	54393 → 443 [ACK] Seq=1 Ack=1 Win=29312 Len=0 TSval=557125 TSecr=18869
364	12.314700	192.168.1.143	64.233.165.198	TLSv1	272	Client Hello (SNI=www.youtube.com)
365	12.314935	64.233.165.198	192.168.1.143	TCP	66	443 → 54393 [ACK] Seq=1 Ack=207 Win=30016 Len=0 TSval=18871 TSecr=557125
877	42.310031	192.168.1.143	64.233.165.198	TCP	66	54393 → 443 [FIN, ACK] Seq=207 Ack=1 Win=29312 Len=0 TSval=564625 TSecr=18871
878	42.354332	64.233.165.198	192.168.1.143	TCP	66	443 → 54393 [ACK] Seq=1 Ack=208 Win=30016 Len=0 TSval=26381 TSecr=564625
Ну последняя строчка это как я понял ответ от сервака пришел до получения фина.

**Comment by eastone11** [comment]
если ты поставишь 69.8 то будет работать? конфиг какой?

**Comment by Dager26reg** [comment]
69.8 не знаю, предидущая система была еще со старым инсталятором. Я долго не обновлял. По поводу конфига - дефолтный конфиг, кромоме дополнительного правила для доменов ютуба в котором фейк отсылается гугл.ком. Остальное все стандартное. ПРи этом на андроиде и ПК отлично все работает. Но там Варешарп показывает запросы TLS1.3

**Comment by eastone11** [comment]
> 69.8 не знаю, предидущая система была еще со старым инсталятором. Я долго не обновлял. По поводу конфига - дефолтный конфиг, кромоме дополнительного правила для доменов ютуба в котором фейк отсылается гугл.ком. Остальное все стандартное. ПРи этом на андроиде и ПК отлично все работает. Но там Варешарп показывает запросы TLS1.3

кинь конфиг

**Comment by Dager26reg** [comment]
Если быть точным то предидущая сборка была установлена с мастерканала в котором еще присутствовали бинарники.

**Comment by Dager26reg** [comment]
> кинь конфиг

Ты не в роскомнадзоре часом работаешь? )))))

**Comment by eastone11** [comment]
именно оттуда, скорей кидай, сейчас заблочу его!

**Comment by bol-van** [comment]
Информации минимум
С какой версии было обновление
какой конфиг ? еще с NFQWS_OPT_DESYNC ? тогда понятное дело ничего не заработает, инсталятор даже откажется его обновлять
параметры запуска, --debug лог

**Comment by Dager26reg** [comment]
> С какой версии было обновление
> какой конфиг ? еще с NFQWS_OPT_DESYNC ? тогда понятное дело ничего не заработает, инсталятор даже откажется его обновлять
Да, еще с такой строчкой конфигурации. Но новую я настраивал с 0, тоесть все снес, новую закачал, и провел скрипт инстал изи, и там по мастеру произвел конфигурациюс той лиш разницей что добавил еще строку для хостов ютуба - отсылать файк с тлс - ввв.гугл.ком. В броузере на ПК и на аднроиде ютуб открывает нормально. Варешарп при этом показывает КлиентХелло версии 1.3 а вот от самсунга идет как в сообщениях выше.

**Comment by bol-van** [comment]
Стратегию надо подбирать под TLS 1.2
От просекания ответа сервера спасают лучше всего правильно подобранные фейки, а как последнее средство - wssize
Еще надо резать googlevideo.com или повторять фейки, тк могут сечь stateless подстроку "googlevideo" в некотором количестве начальных пакетов

**Comment by Dager26reg** [comment]
Так под ТЛС1.2 и 1.3 все и работает как часы. ПРоблема как раз в том что телики самсунг, через встроенный смарт приложения ютуба шлют такие запросы. и на них ютуб не открывается. На других устройств нет проблем. А почему спросил что когда стояла старая версия запрета еще с конфигурацией NFQWS_OPT_DESYNC там для дурения googlevideo.com использовался фейк с ццц.гугл.ком и ттл = 0, и эта стратегия работала до поры до времени, но в последнее время ютуб стал глючить с ней, открывались не все видосы сразу и наблюдалось некоторое подвисание видео в начале секунд на 20, иногда видос не грузился совсем, но если наджать назад и снова выбрать ролик то играл без проблем. На новом запрете проблем и лагов не наблюдается совсем. Только вот с теликами самсунд беда. 
Потому и написал спросить может можно как-то сделать чтоб и на самсунгах начало работать?

**Comment by ivdeveloper86** [comment]
Интересно как именно вы определили, что у вас TLS1.2 и 1.3 работает как часы? :)
На компе и телефоне обычно протокол QUIC либо TLS1.3
На телеках используется TLS1.2 который дурить сложнее всего, нужно подбирать стратегию с пробиванием ТСПУ пакетами с помощью --dpi-desync-repeats
Если вы не в состоянии сюда даже конфиг свой скинуть, то вряд ли вам кто-то поможет.

**Comment by Dager26reg** [comment]
> Интересно как именно вы определили, что у вас TLS1.2 и 1.3 работает как часы? :) На компе и телефоне обычно протокол QUIC либо TLS1.3 На телеках используется TLS1.2 который дурить сложнее всего, нужно подбирать стратегию с пробиванием ТСПУ пакетами с помощью --dpi-desync-repeats Если вы не в состоянии сюда даже конфиг свой скинуть, то вряд ли вам кто-то поможет.

Waresharp показывает версию протокола. И насколько мне известно QUIC идет через UDP соединение, А там TCP. 
Когда идут  TLS1.2 и 1.3 - идет установка шифрованного соединения и происходит обмен ключами - так и определяю что работает как часы.
А на самом первом сообщении видно что запрос Варешарп пометил как TLSv1 без дроби. И ответа от сервера уже не приходит. 
Кроме того curl можно заставить с командной строки ключами отправлять запрос на необходимом протоколе шифрования. И с помощью нее исследовать открывается ли сайт или нет.

**Comment by whitemagg** [comment]
Столкнулся с идентичной проблемой, только телевизор lg 2018 года. Также использует tls 1.0. на старом zaprete работает, на новой версии нет. Получилось ли решить?

**Comment by kpbicka** [comment]
> на старом zaprete работает

это какая версия?

**Comment by Dager26reg** [comment]
> > на старом zaprete работает
> 
> это какая версия?

Была v.63 
Но то была сборка еще со стаым конфигуратором. Со сточкой NFQWS_OPT_DESYNC
Я так понял автор пересобрал все предидущие версии под новый конфигуратор.

**Comment by Dager26reg** [comment]
Еще в автохост файле стали появляться записи таких доменов:
rr9---sn-n8v7znz7.googl
rr2---sn-n8v7znzl.googl
rr5---sn-n8v7znze.googl
clients1.goo
rr8---sn-n8v7zns7.googl
r1---sn-4g5e6ns6.googl
rr11---sn-n8v7kn7l.googl
r3---sn-4g5ednds.googl
rr4---sn-n8v7kn7s.googl
rr5---sn-n8v7znse.googl
r5---sn-n8v7znse.googl
rr15---sn-n8v7knee.googl
Как можно заметить это огрызки доменов, (1 их часть разрезанная посередине домена 2 уровня.)

**Comment by punkgendos** [comment]
у меня не работало именно на самсунге на одной из предыдущих версий, не скажу на какой, потому что не помню, настраивал ещё в октябре, сейчас обновился до версии 70, и всё заработало

**Comment by kpbicka** [comment]
> у меня не работало именно на самсунге на одной из предыдущих версий, не скажу на какой, потому что не помню, настраивал ещё в октябре, сейчас обновился до версии 70, и всё заработало

А можно конфиг посмотреть?

**Comment by punkgendos** [comment]
> > у меня не работало именно на самсунге на одной из предыдущих версий, не скажу на какой, потому что не помню, настраивал ещё в октябре, сейчас обновился до версии 70, и всё заработало
> 
> А можно конфиг посмотреть?

NFQWS_OPT="
--filter-tcp=80 --hostlist=/opt/zapret/ipset/zapret-hosts-user.txt --dpi-desync=fake,split2 --dpi-desync-autottl=2 --dpi-desync-fooling=md5sig --new
--filter-tcp=443 --hostlist=/opt/zapret/ipset/zapret-hosts-user.txt --dpi-desync=fake,split2 --dpi-desync-repeats=11 --dpi-desync-fooling=md5sig --dpi-desync-fake-tls=/opt/zapret/files/fake/tls_clienthello_www_google_com.bin --new
--filter-tcp=80,443 --hostlist=/opt/zapret/ipset/zapret-hosts-user.txt --dpi-desync=fake,disorder2 --dpi-desync-repeats=6 --dpi-desync-autottl=2 --dpi-desync-fooling=md5sig --new
--filter-udp=[50000-50099](tel:50000-50099) --hostlist=/opt/zapret/ipset/zapret-hosts-user.txt --dpi-desync=fake --dpi-desync-repeats=6 --dpi-desync-any-protocol --dpi-desync-cutoff=n4 --new
--filter-udp=443 --hostlist=/opt/zapret/ipset/zapret-hosts-user.txt --dpi-desync=fake --dpi-desync-repeats=11 --dpi-desync-fake-quic=/opt/zapret/files/fake/quic_initial_www_google_com.bin
"

**Comment by kpbicka** [comment]
> > > у меня не работало именно на самсунге на одной из предыдущих версий, не скажу на какой, потому что не помню, настраивал ещё в октябре, сейчас обновился до версии 70, и всё заработало
> > 
> > 
> > А можно конфиг посмотреть?
> 
> NFQWS_OPT=" --filter-tcp=80 --hostlist=/opt/zapret/ipset/zapret-hosts-user.txt --dpi-desync=fake,split2 --dpi-desync-autottl=2 --dpi-desync-fooling=md5sig --new --filter-tcp=443 --hostlist=/opt/zapret/ipset/zapret-hosts-user.txt --dpi-desync=fake,split2 --dpi-desync-repeats=11 --dpi-desync-fooling=md5sig --dpi-desync-fake-tls=/opt/zapret/files/fake/tls_clienthello_www_google_com.bin --new --filter-tcp=80,443 --hostlist=/opt/zapret/ipset/zapret-hosts-user.txt --dpi-desync=fake,disorder2 --dpi-desync-repeats=6 --dpi-desync-autottl=2 --dpi-desync-fooling=md5sig --new --filter-udp=50000-50099 --hostlist=/opt/zapret/ipset/zapret-hosts-user.txt --dpi-desync=fake --dpi-desync-repeats=6 --dpi-desync-any-protocol --dpi-desync-cutoff=n4 --new --filter-udp=443 --hostlist=/opt/zapret/ipset/zapret-hosts-user.txt --dpi-desync=fake --dpi-desync-repeats=11 --dpi-desync-fake-quic=/opt/zapret/files/fake/quic_initial_www_google_com.bin "

в списке zapret-hosts-user.txt много хостов?

**Comment by punkgendos** [comment]
> > > > у меня не работало именно на самсунге на одной из предыдущих версий, не скажу на какой, потому что не помню, настраивал ещё в октябре, сейчас обновился до версии 70, и всё заработало
> > > 
> > > 
> > > А можно конфиг посмотреть?
> > 
> > 
> > NFQWS_OPT=" --filter-tcp=80 --hostlist=/opt/zapret/ipset/zapret-hosts-user.txt --dpi-desync=fake,split2 --dpi-desync-autottl=2 --dpi-desync-fooling=md5sig --new --filter-tcp=443 --hostlist=/opt/zapret/ipset/zapret-hosts-user.txt --dpi-desync=fake,split2 --dpi-desync-repeats=11 --dpi-desync-fooling=md5sig --dpi-desync-fake-tls=/opt/zapret/files/fake/tls_clienthello_www_google_com.bin --new --filter-tcp=80,443 --hostlist=/opt/zapret/ipset/zapret-hosts-user.txt --dpi-desync=fake,disorder2 --dpi-desync-repeats=6 --dpi-desync-autottl=2 --dpi-desync-fooling=md5sig --new --filter-udp=50000-50099 --hostlist=/opt/zapret/ipset/zapret-hosts-user.txt --dpi-desync=fake --dpi-desync-repeats=6 --dpi-desync-any-protocol --dpi-desync-cutoff=n4 --new --filter-udp=443 --hostlist=/opt/zapret/ipset/zapret-hosts-user.txt --dpi-desync=fake --dpi-desync-repeats=11 --dpi-desync-fake-quic=/opt/zapret/files/fake/quic_initial_www_google_com.bin "
> 
> в списке zapret-hosts-user.txt много хостов? у меня на телевизоре не хочет ни при каких конфигах, а на всем другом работает

googlevideo.com
youtubei.googleapis.com
ytimg.com
yt3.ggpht.com
yt4.ggpht.com
youtube.com
youtubeembeddedplayer.googleapis.com
ytimg.l.google.com
jnn-pa.googleapis.com
youtube-nocookie.com
youtube-ui.l.google.com
yt-video-upload.l.google.com
wide-youtube.l.google.com

у меня ещё в настройках роутера стоит, чтобы все клиентам принудительно выдавался днс 8.8.8.8
на openwrt это делается в Сеть - Интерфейсы - br-lan - DHCP-сервер - Расширенные настройки, в поле DHСР-Options вводим 6,8.8.8.8

**Comment by kpbicka** [comment]
> > > у меня не работало именно на самсунге на одной из предыдущих версий, не скажу на какой, потому что не помню, настраивал ещё в октябре, сейчас обновился до версии 70, и всё заработало
> > 
> > 
> > А можно конфиг посмотреть?
> 
> NFQWS_OPT=" 
--filter-tcp=80 
--filter-tcp=443
--filter-tcp=80,443 
--filter-udp=50000-50099 
--filter-udp=443 

а вот смотри. в правилах идёт сначала фильтр tcp80, потом фильтр tcp443, а потом третья строка опять фильтр tcp80,443

**Comment by bol-van** [comment]
hostlist тоже является частью фильтра

**Comment by kpbicka** [comment]
> hostlist тоже является частью фильтра

это конечно да, но вопрос в том что - а не излишне ли писать сначала tcp80 потом  tcp433 и третьей строкой снова 80 и 443

**Comment by Dager26reg** [comment]
> > > > у меня не работало именно на самсунге на одной из предыдущих версий, не скажу на какой, потому что не помню, настраивал ещё в октябре, сейчас обновился до версии 70, и всё заработало
> > > 
> > > 
> > > А можно конфиг посмотреть?
> > 
> > 
> > NFQWS_OPT="
> > --filter-tcp=80
> > --filter-tcp=443
> > --filter-tcp=80,443
> > --filter-udp=50000-50099
> > --filter-udp=443
> 
> а вот смотри. в правилах идёт сначала фильтр tcp80, потом фильтр tcp443, а потом третья строка опять фильтр tcp80,443 не много ли одинаковых фильтров? ))

Ну насколько я понял правило --filter-tcp=80,443 --hostlist=/opt/zapret/ipset/zapret-hosts-user.txt --dpi-desync=fake,disorder2 --dpi-desync-repeats=6 --dpi-desync-autottl=2 --dpi-desync-fooling=md5sig --new 
Стоящее в середине работать не будет, так как используется один и тот же список доменов для фильтрации, и будет применено правило которое идет выше отдельно для tcp80 и для tcp443

**Comment by kpbicka** [comment]
> Ну насколько я понял правило --filter-tcp=80,443 --hostlist=/opt/zapret/ipset/zapret-hosts-user.txt --dpi-desync=fake,disorder2 --dpi-desync-repeats=6 --dpi-desync-autottl=2 --dpi-desync-fooling=md5sig --new Стоящее в середине работать не будет, так как используется один и тот же список доменов для фильтрации, и будет применено правило которое идет выше отдельно для tcp80 и для tcp443

это надо спросить автора @bol-van - какое правило сработает - первое и остальные отбрасываются или наоборот последнее?

**Comment by Dager26reg** [comment]
Вообщем у меня стоит версия 69.9 на данный момент под архитектуру aarch64 на кинетике peak.
Со слудующими правилами:
--filter-tcp=80 --dpi-desync=fake,multisplit --dpi-desync-split-pos=method+2 --dpi-desync-fooling=md5sig <HOSTLIST> --new
--filter-tcp=443 --dpi-desync=fake,multidisorder --dpi-desync-split-pos=1,midsld --dpi-desync-fooling=badseq,md5sig --dpi-desync-fake-tls=/opt/zapret/files/fake/tls_clienthello_www_google_com.bin --hostlist=/opt/zapret/youtube.txt --new
--filter-tcp=443 --dpi-desync=fake,multidisorder --dpi-desync-split-pos=midsld --dpi-desync-fooling=badseq,md5sig <HOSTLIST> --new
--filter-udp=443 --dpi-desync=fake --dpi-desync-repeats=11 --dpi-desync-fake-quic=/opt/zapret/files/fake/quic_initial_www_google_com.bin --hostlist=/opt/zapret/youtube.txt --new
--filter-udp=443 --dpi-desync=fake --dpi-desync-repeats=6 <HOSTLIST_NOAUTO>
Но у меня нет теликов не ЛЖ не самсунг, на телфонах, планшетах на андроиде, на айфонах, а также приставке STB ютуб работает без проблем. 
Но вот ребятам которым я поставил эту же сборку 69.9 на роутеры viva они послабее, и под архитекруру mips32r1-lsb у них на той же конфигурации в консоль сыпятся ошибки сегментейшен фаулт, читал мануале про эту ошибку про смого точек сплита, но так и не понял в данном конфиге вроде всего 2 точки сплита используются, что не так, и у них в автохостфайле появляются регулярно огрызки доменов типа вот таких
rr9---sn-n8v7znz7.googl
rr2---sn-n8v7znzl.googl
rr5---sn-n8v7znze.googl
clients1.goo
И вот у них дома ютуб не показывает на встроенное приложение теликов сансунг и ЛЖ, к сожелению я только смог захватить трафик с 1 телика в файл для варешарпа, которыу я показал в начале поста. Но как оказалось что мой комп на вин7, и хроме который уже давно не отправляется тоже шлет запросы которые варешарп отображает как TLSv1 и при этом все прекрасно открывается, и работает. Правила все четко срабатывают.
Ранее появлялось сообщение что сегментейшен фаулт появляется изза сжатия бинарников UPX, но я пробовал расжать бинарник NFQWS, но это не дало никакого эффекта.
В планах поставить версию 70, посмотрю как там будет.

**Comment by Dager26reg** [comment]
> это надо спросить автора [@bol-van](https://github.com/bol-van) - какое правило сработает - первое и остальные отбрасываются или наоборот последнее?

Правила прасматриваются слева направо в одной строке, и разделяются директивой --new просто для удобства их можно записывать в отдельную строку. И правило смотрит протокол - хост файл, если совпадение есть применяется правило, если совпадения нет переходит к следующей группе --new и так далее, пока не найдет совпадение. Если совпадения найдены по хостфайлу и протоколу в предищущем правиле - до слледующего набора правил уже не пойдет.

**Comment by punkgendos** [comment]
> > > > у меня не работало именно на самсунге на одной из предыдущих версий, не скажу на какой, потому что не помню, настраивал ещё в октябре, сейчас обновился до версии 70, и всё заработало
> > > 
> > > 
> > > А можно конфиг посмотреть?
> > 
> > 
> > NFQWS_OPT="
> > --filter-tcp=80
> > --filter-tcp=443
> > --filter-tcp=80,443
> > --filter-udp=50000-50099
> > --filter-udp=443
> 
> а вот смотри. в правилах идёт сначала фильтр tcp80, потом фильтр tcp443, а потом третья строка опять фильтр tcp80,443 не много ли одинаковых фильтров? ))

честно, я так до конца и не разобрался с этим делом, мне оно тоже резало глаз, но оно работает в таком виде, я и не трогаю на всякий случай)

**Comment by dlempty** [comment]
проблему с Самсунгом то решили?

**Comment by dlempty** [comment]
> путем эксперемементального анализа данных блокчека можно подобрать. когда пробуешь/перебираешь стратегии надо что бы курлом сдергвался любой торент с рутрекера и без ошибок ( на сертификат) возвращался ответ например от `curl https://rr15---sn-n8v7znly.googlevideo.com/ --tls-max 1.2 -v`
> 
> заметил что не стоит ставить большое количесво репитов ( у меня 5) и похоже что dpi как то "возбуждается" когда перебираешь стратегии. а вот через сколько у него пропадает эрекция я не понял. на телеке все работает, но может быть пауза в 1-3 сек перед началом проигрывания. далее все нормуль.

но я правильно понимаю что курл надо запускать с машины за роутером если запрет стоит на роутере?

**Comment by dlempty** [comment]
> путем эксперемементального анализа данных блокчека можно подобрать. когда пробуешь/перебираешь стратегии надо что бы курлом сдергвался любой торент с рутрекера и без ошибок ( на сертификат) возвращался ответ например от `curl https://rr15---sn-n8v7znly.googlevideo.com/ --tls-max 1.2 -v`
> 
> заметил что не стоит ставить большое количесво репитов ( у меня 5) и похоже что dpi как то "возбуждается" когда перебираешь стратегии. а вот через сколько у него пропадает эрекция я не понял. на телеке все работает, но может быть пауза в 1-3 сек перед началом проигрывания. далее все нормуль.

и еще можешь пример успешного ответа показать?

**Comment by AlexTransit** [comment]
> но я правильно понимаю что курл надо запускать с машины за роутером если запрет стоит на роутере?

пофиг где. главное что бы запрос через дурилку прошел

> и еще можешь пример успешного ответа показать?

я дал стратегии знакомому и у него по одному адресу заработало, а по другому нет, теперь точно знаю что они работают не у всех.  :)
лучше попробую научить что сделать как находить необходимые стратегии.

для начала нужно сделать что бы обычный DNS не работал. ( наружу на UDP 53 не должно быть никаких запросов )
все DNS запросы должны быть шифрованные. ( tcpdump это подтверждает )
проверить можно тут
https://www.cloudflare.com/ssl/encrypted-sni/
у меня результат положительный на все типы. 
думаю что работающий ipv6 тоже добавит плюсов в карму :)
проветить просто. 
если пингануть ya.ru и резолвиться ipv6 - значит маршрут работает.
_PING_ ya.ru(ya.ru (2a02:6b8::2:242))_

потом запускаете блокчек. я сайты указывал rutracker.org lostfilm.tv rr15---sn-n8v7znly.googlevideo.com
рутрекер и лостовцы сидят на слоудфайре, вроде хостер один, но dpi возбуждается по разному.
потом полученный результат загрузил в excel и сделав povot table ( сводную таблицу ) получил стратегии, которые подходят для всех. на протоколах ipv4 b ipv6

проверял курлом. когда нормально отрабатывало на компе, проверил на телевизоре. я то ютуб не смотрю, но иногда там включают мульты для внука. :)

из десинка использовал только fake, есть fooling и фейковый tls. оказалось важным количество репитов. у меня их 5. 
если мало или много , то ломается то что не должно ломаться. :)
стратегии. для дискорда использовал рекомендацию от автора
### --filter-udp=50000-50099 --filter-l7=discord,stun --dpi-desync=fake --new

я не знаю через какой протокол телек гонит поток с ютуба, но знаю что очень просто потобрать стратегию для компа или телефона, и сложнее для телека.

**Comment by dlempty** [comment]
> > но я правильно понимаю что курл надо запускать с машины за роутером если запрет стоит на роутере?
> 
> пофиг где. главное что бы запрос через дурилку прошел
> 
> > и еще можешь пример успешного ответа показать?
> 
> я дал стратегии знакомому и у него по одному адресу заработало, а по другому нет, теперь точно знаю что они работают не у всех. :) лучше попробую научить что сделать как находить необходимые стратегии.
> 
> для начала нужно сделать что бы обычный DNS не работал. ( наружу на UDP 53 не должно быть никаких запросов ) все DNS запросы должны быть шифрованные. ( tcpdump это подтверждает ) проверить можно тут https://www.cloudflare.com/ssl/encrypted-sni/ у меня результат положительный на все типы. думаю что работающий ipv6 тоже добавит плюсов в карму :) проветить просто. если пингануть ya.ru и резолвиться ipv6 - значит маршрут работает. _PING_ ya.ru(ya.ru (2a02:6b8::2:242))_
> 
> потом запускаете блокчек. я сайты указывал rutracker.org lostfilm.tv rr15---sn-n8v7znly.googlevideo.com рутрекер и лостовцы сидят на слоудфайре, вроде хостер один, но dpi возбуждается по разному. потом полученный результат загрузил в excel и сделав povot table ( сводную таблицу ) получил стратегии, которые подходят для всех. на протоколах ipv4 b ipv6
> 
> проверял курлом. когда нормально отрабатывало на компе, проверил на телевизоре. я то ютуб не смотрю, но иногда там включают мульты для внука. :)
> 
> из десинка использовал только fake, есть fooling и фейковый tls. оказалось важным количество репитов. у меня их 5. если мало или много , то ломается то что не должно ломаться. :) стратегии. для дискорда использовал рекомендацию от автора
> 
> ### --filter-udp=50000-50099 --filter-l7=discord,stun --dpi-desync=fake --new
> я не знаю через какой протокол телек гонит поток с ютуба, но знаю что очень просто потобрать стратегию для компа или телефона, и сложнее для телека.

да мне не стратегия нужна а как должен курл ответить на получение правильного ответа ))

**Comment by AlexTransit** [comment]
> да мне не стратегия нужна а как должен курл ответить на получение правильного ответа ))

curl -v всегда должен отработать без задержек и явных ошибок курла.

**Comment by Dager26reg** [comment]
> проблему с Самсунгом то решили?

Да вроде лечится добавляя в последней строчкой в стратегии такую
--filter-udp=443 --dpi-desync=fake --dpi-desync-any-protocol --dpi-desync-cutoff=d2 --dpi-desync-repeats=7

Там новая беда пришла откуда не ждали. 
Стали блочить трафик дето на промежуточных узлах по типу как замедляли ютуб, В блокировку попало оооооочень много ресурсов, причем многие вообще вызывают недоумение.
Обхзодится новой версией запрета, но с нюансами. Новая блокировка не дропает соединение, а оно проходит, ТСЛ-сессия устанавливается, проходит несколько пакетов туда обратно, но замедленно, а потом и вовсе перестают приходить ответ от сервера, якобы плохое соединение, Комп заново инициализирует соединение по таймауту, оно снова проходит и процесс повторяется. 
Запрет не понимает что это заблокированный ресурс и не применячет обход. Если вписать домен в ручную то все чудешнейшим образом начинает работать на нормальной скорости.
Как я понял они там еще и стали вылавливать стандартные фейки чтоль, там де фингерпритнт или сессионИД зашит в прогу. Если их менять на валидный то все пашет. 
И еще с рутрекером непонятки. если фейк ставишь гугловский домен работает, ставишь к примеру госуслуги - перестает работать. 
Такие дела.
Чебурнет детектед

**Comment by posterrr92** [comment]
> Да вроде лечится добавляя в последней строчкой в стратегии такую --filter-udp=443 --dpi-desync=fake --dpi-desync-any-protocol --dpi-desync-cutoff=d2 --dpi-desync-repeats=7

Можете пожалуйста выложить полную стратегию для примера? 
вчера настраивал телефон андройд и комп спокойно завелись , а 2 телевизора (самсунг и андройдовский) никак.  
прошу сильно не ругать, я в сетевом админстрировании полный профан... 
пару вопрсов 1) стратегии на tcp 80 и tcp 443 должны быть различные ? или нужно как то отдельно подбирать под определенный порт? соответственно про udp тот же  вопрос 
2) корректно ли  оставлять  хостлист в таком виде ? 
пример (--filter-tcp=80 --dpi-desync=fake,multisplit --dpi-desync-split-pos=method+2 --dpi-desync-fooling=md5sig <HOSTLIST> --new) 
или нужно ссылать на него в таком виде  пример ( --hostlist=/opt/zapret/ipset/zapret-hosts-user.txt) ?
  где выставлять хост лист в начале стратегии или в конце ? 
3) не могу понять, нужно ли вставлять данный параметр в стратегию  ?   основная задача конечно на ТВ чтобы ютуб работал
--dpi-desync-fake-tls=/opt/zapret/files/fake/tls_clienthello_www_google_com.bin    или это blockcheck стратегия должна подобрать ?

**Comment by AlexTransit** [comment]
по поводу --new
становиться все понятней если написать NFQWS_OPT в одну строку.
получается 
`NFQWS_OPT="стратегия1 параметр1 ... параметрN --new стратегия2 параметр1 ... параметрN --new стратегияN параметр1 ... параметрN"`
просто с переносом строки понятней для людей.

**Comment by tolya2100** [comment]
Помогите, пожалуйста. Всё работает, кроме телека Самсунг на Tizen.

**Comment by punkgendos** [comment]
у меня несколько месяцев не работал, сейчас вдруг заработал с такими параметрами --filter-tcp=443 --dpi-desync=fake --dpi-desync-fooling=md5sig --dpi-desync-fake-tls=0x00000000 --dpi-desync-fake-tls=! --dpi-desync-fake-tls-mod=rnd,rndsni,dupsid

**Comment by punkgendos** [comment]
у меня вдруг заработал Samsung на Tizen OS. Не знаю какая именно стратегия работает для самсунга, не проверял отдельно, но параметры запрета следующие:


NFQWS_OPT="
--filter-tcp=80 --hostlist=/opt/zapret/ipset/youtube.txt --dpi-desync=fake,fakedsplit --dpi-desync-autottl=2 --dpi-desync-fooling=badsum --new
--filter-tcp=443 --hostlist=/opt/zapret/ipset/ytvideo.txt --dpi-desync=multidisorder --dpi-desync-split-pos=1,sniext+1,host+1,midsld-2,midsld,midsld+2,endhost-1 --new
--filter-tcp=443 --hostlist=/opt/zapret/ipset/youtube.txt --dpi-desync=fake,multisplit --dpi-desync-fake-tls=0x00000000 --dpi-desync-fake-tls=! --dpi-desync-split-pos=1,midsld --dpi-desync-repeats=2 --dpi-desync-fooling=badseq --dpi-desync-fake-tls-mod=rnd,dupsid,sni=www.google.com --new
--filter-udp=443 --hostlist=/opt/zapret/ipset/ytvideo.txt --dpi-desync=fake --dpi-desync-repeats=11 --dpi-desync-fake-quic=/opt/zapret/files/fake/quic_initial_www_google_com.bin
"


в файле youtube.txt:

youtubei.googleapis.com
ytimg.com
yt3.ggpht.com
yt4.ggpht.com
youtube.com
youtu.be
youtubeembeddedplayer.googleapis.com
ytimg.l.google.com
jnn-pa.googleapis.com
youtube-nocookie.com
youtube-ui.l.google.com
yt-video-upload.l.google.com
wide-youtube.l.google.com


в файле ytvideo.txt:

googlevideo.com


UPD: не всегда загружается с первого раза, иногда приходится несколько раз выходить, заходить в приложение YouTube

**Comment by kpbicka** [comment]
> у меня вдруг заработал Samsung на Tizen OS

Да чёт не сработало на Apple TV
Вот куда оно лезет : 

In  IP 10.0.1.99.49275 > prg03s11-in-f14.1e100.net.https: Flags [SEW], seq 686663831, win 65535, options [mss 1460,nop,wscale 6,nop,nop,TS val 2942766516 ecr 0,sackOK,eol], length 0

Out IP 10.0.1.99.49275 > prg03s11-in-f14.1e100.net.https: Flags [SEW], seq 686663831, win 65535, options [mss 1460,nop,wscale 6,nop,nop,TS val 2942766516 ecr 0,sackOK,eol], length 0

не работает только на  AppleTV, на всех других устройствах ок

Как бы понять, что делать с этим prg03s11-in-f14.1e100.net

**Comment by kolmakova** [comment]
@punkgendos да, сработало на Samsung на Tizen OS:

````
--filter-tcp=443 
--hostlist=/opt/zapret/ipset/zapret-hosts-google.txt 
--dpi-desync=fake,multisplit 
--dpi-desync-fake-tls=0x00000000 
--dpi-desync-fake-tls=! 
--dpi-desync-split-pos=1,midsld 
--dpi-desync-repeats=2 
--dpi-desync-fooling=badseq 
--dpi-desync-fake-tls-mod=rnd,dupsid,sni=www.google.com
````

[zapret-hosts-google.txt](https://github.com/user-attachments/files/23234724/zapret-hosts-google.txt)
