### ISSUE TITLE
При установке на роутер, работает только на компьютере с windows, на всех остальных уст-ах -- нет

### ISSUE THREAD

**Issue by Qeeckleeero** [bol-van/zapret#1196]
Пинг с ноута: (подключен по Wi-Fi)
```
C:\Users\Ciri>ping -n 50 rutracker.org
Обмен пакетами с rutracker.org [104.21.32.39] с 32 байтами данных:
Ответ от 104.21.32.39: число байт=32 время=100мс TTL=51
Ответ от 104.21.32.39: число байт=32 время=135мс TTL=51
Ответ от 104.21.32.39: число байт=32 время=93мс TTL=51 
Ответ от 104.21.32.39: число байт=32 время=114мс TTL=51
Ответ от 104.21.32.39: число байт=32 время=139мс TTL=51
Ответ от 104.21.32.39: число байт=32 время=143мс TTL=51
Ответ от 104.21.32.39: число байт=32 время=128мс TTL=51
Ответ от 104.21.32.39: число байт=32 время=99мс TTL=51 
Ответ от 104.21.32.39: число байт=32 время=148мс TTL=51
Ответ от 104.21.32.39: число байт=32 время=110мс TTL=51
Превышен интервал ожидания для запроса.
Ответ от 104.21.32.39: число байт=32 время=103мс TTL=51
Ответ от 104.21.32.39: число байт=32 время=99мс TTL=51 
Ответ от 104.21.32.39: число байт=32 время=131мс TTL=51
Ответ от 104.21.32.39: число байт=32 время=130мс TTL=51
Ответ от 104.21.32.39: число байт=32 время=131мс TTL=51
Ответ от 104.21.32.39: число байт=32 время=117мс TTL=51
Ответ от 104.21.32.39: число байт=32 время=98мс TTL=51 
Превышен интервал ожидания для запроса.
Ответ от 104.21.32.39: число байт=32 время=130мс TTL=51
Ответ от 104.21.32.39: число байт=32 время=113мс TTL=51
Ответ от 104.21.32.39: число байт=32 время=106мс TTL=51
Превышен интервал ожидания для запроса.
Ответ от 104.21.32.39: число байт=32 время=151мс TTL=51
Превышен интервал ожидания для запроса.
Ответ от 104.21.32.39: число байт=32 время=106мс TTL=51
Ответ от 104.21.32.39: число байт=32 время=125мс TTL=51
Превышен интервал ожидания для запроса.
Ответ от 104.21.32.39: число байт=32 время=106мс TTL=51
Ответ от 104.21.32.39: число байт=32 время=110мс TTL=51
Ответ от 104.21.32.39: число байт=32 время=100мс TTL=51
Ответ от 104.21.32.39: число байт=32 время=229мс TTL=51
Ответ от 104.21.32.39: число байт=32 время=94мс TTL=51 
Ответ от 104.21.32.39: число байт=32 время=125мс TTL=51
Ответ от 104.21.32.39: число байт=32 время=453мс TTL=51
Ответ от 104.21.32.39: число байт=32 время=105мс TTL=51
Ответ от 104.21.32.39: число байт=32 время=95мс TTL=51 
Ответ от 104.21.32.39: число байт=32 время=93мс TTL=51 
Ответ от 104.21.32.39: число байт=32 время=114мс TTL=51
Ответ от 104.21.32.39: число байт=32 время=115мс TTL=51
Ответ от 104.21.32.39: число байт=32 время=86мс TTL=51 
Ответ от 104.21.32.39: число байт=32 время=117мс TTL=51
Превышен интервал ожидания для запроса.
Превышен интервал ожидания для запроса.
Ответ от 104.21.32.39: число байт=32 время=132мс TTL=51
Ответ от 104.21.32.39: число байт=32 время=108мс TTL=51
Ответ от 104.21.32.39: число байт=32 время=120мс TTL=51
Ответ от 104.21.32.39: число байт=32 время=114мс TTL=51
Превышен интервал ожидания для запроса.
Ответ от 104.21.32.39: число байт=32 время=112мс TTL=51
Статистика Ping для 104.21.32.39: 
Пакетов: 
отправлено = 50, получено = 42, потеряно =  8 (16% потерь)
Приблизительное время приема-передачи в мс: 
Минимальное = 86 мсек, Максимальное = 453 мсек, Среднее = 125 мсек
```

Пинг с телефона: (iPhone, Wi-Fi)
```
PING rutracker.org (104.21.32.39): 64 data bytes
------
Request timeout for icmp_seq 0
Request timeout for icmp_seq 1
Request timeout for icmp_seq 2
Request timeout for icmp_seq 3
Request timeout for icmp_seq 4
Request timeout for icmp_seq 5
Request timeout for icmp_seq 6
Request timeout for icmp_seq 7
Request timeout for icmp_seq 8
Request timeout for icmp_seq 9
Request timeout for icmp_seq 10
Request timeout for icmp_seq 11
Request timeout for icmp_seq 12
Request timeout for icmp_seq 13
Request timeout for icmp_seq 14
Request timeout for icmp_seq 15
Request timeout for icmp_seq 16
Request timeout for icmp_seq 17
Request timeout for icmp_seq 18
Request timeout for icmp_seq 19
Request timeout for icmp_seq 20
Request timeout for icmp_seq 21
Request timeout for icmp_seq 22
Request timeout for icmp_seq 23
Request timeout for icmp_seq 24
Request timeout for icmp_seq 25
Request timeout for icmp_seq 26
Request timeout for icmp_seq 27
Request timeout for icmp_seq 28
Request timeout for icmp_seq 29
Request timeout for icmp_seq 30
Request timeout for icmp_seq 31
Request timeout for icmp_seq 32
Request timeout for icmp_seq 33
Request timeout for icmp_seq 34
Request timeout for icmp_seq 35
Request timeout for icmp_seq 36
Request timeout for icmp_seq 37
Request timeout for icmp_seq 38
Request timeout for icmp_seq 39
Request timeout for icmp_seq 40
Request timeout for icmp_seq 41
Request timeout for icmp_seq 42
Request timeout for icmp_seq 43
Request timeout for icmp_seq 44
--- rutracker.org ping statistics ---
50 packets transmitted, 0 packets received, 100.0% packet loss
```

Проверял с двух айфонов, айпада, андройд тв и с ноутбука, работает только на ноуте, подозреваю это как-то связано с тем, что он  единственный на винде. 
DNS нигде нет, на ноуте проверял с включенным и с выключенным quic, работает в обеих случаях.
ВПН тоже нигде нет, никаких локальных сетей помимо Wi-Fi нигде нет
На ноуте работает как по LAN, так и по Wi-Fi

P.S.:Сорри, если это решение уже было где-то описано, но я не осилил посмотреть все 800 тикетов
P.P.S.:А есть какая-то возможность удалить эти ~600 бесполезных issues?

**Comment by bol-van** [comment]
zapret никак не влияет на icmp

**Comment by bol-van** [comment]
issue, увы, не удаляются. там большинство закрыто по причине нарушения правил из автоматически подставляемого текста, было и спам нашествие ботов

**Comment by Qeeckleeero** [comment]
> zapret никак не влияет на icmp

В целом, это было чтобы просто показать, что на компе работает, а на телефоне нет. На сайты с компьютера я заходить могу, а с айфона нет. На компьютере я захожу на сайты точно с помощью запрета, потому что когда я его выключаю (на роутере) все снова блокируется.

**Comment by bol-van** [comment]
Для начала я бы проверил линк wifi. Попингать роутер с компа. Если там такие же потери, надо с этим разбираться.
iphone надо смотреть tcpdump-ом на роутере что с него идет

**Comment by Qeeckleeero** [comment]
> Для начала я бы проверил линк wifi. Попингать роутер с компа. Если там такие же потери, надо с этим разбираться.
Пока сделал пинг роутера, 1 потеря на 100 пакетов, эт вроде норм.
А на счет пинга рутрекера, я подозреваю это мой "шикарный" оператор, у меня ужасный пинг и, вероятно, это просто хреновая связь и с моей стороны это не фиксится

Tcpdump пока не завел, ща сделаю

**Comment by Qeeckleeero** [comment]
Вот файл с логами tcpdump'а
[tcpcheckiphone.txt](https://github.com/user-attachments/files/18904379/tcpcheckiphone.txt)

**Comment by bol-van** [comment]
Здесь не видно входящего трафика. Он точно есть, потому что идет обмен по tcp

**Comment by Qeeckleeero** [comment]
```
13:10:46.106239 IP 192.168.1.212.54269 > kndrt41r1.lan.53: 43532+ HTTPS? rutracker.org. (31)
13:10:46.106312 IP 192.168.1.212.62205 > 104.21.32.39.443: UDP, length 1200
13:10:46.167208 IP kndrt41r1.lan.53 > 192.168.1.212.54269: 43532 1/0/0 HTTPS (179)
13:10:46.301249 IP 192.168.1.212.62205 > 104.21.32.39.443: UDP, length 1200
13:10:46.301251 IP 192.168.1.212.58476 > 104.21.32.39.443: Flags [S], seq 3769468781, win 65535, options [mss 1460,nop,wscale 6,nop,nop,TS val 2087404391 ecr 0,sackOK,eol], length 0
13:10:46.317363 IP 192.168.1.212.62370 > 172.67.182.196.443: UDP, length 1200
13:10:46.395045 IP 104.21.32.39.443 > 192.168.1.212.58476: Flags [S.], seq 160098441, ack 3769468782, win 65535, options [mss 1339,sackOK,TS val 3043037138 ecr 2087404391,nop,wscale 13], length 0
13:10:46.469605 IP 192.168.1.212.58476 > 104.21.32.39.443: Flags [.], ack 1, win 2052, options [nop,nop,TS val 2087404561 ecr 3043037138], length 0
13:10:46.470468 IP 192.168.1.212.58476 > 104.21.32.39.443: Flags [P.], seq 1:518, ack 1, win 2052, options [nop,nop,TS val 2087404561 ecr 3043037138], length 517
13:10:46.544000 IP 104.21.32.39.443 > 192.168.1.212.58476: Flags [F.], seq 4294965970:4294966082, ack 518, win 32120, length 112
13:10:46.557761 IP 192.168.1.212.58476 > 104.21.32.39.443: Flags [.], ack 1, win 2052, options [nop,nop,TS val 2087404650 ecr 3043037138,nop,nop,sack 1 {4294965970:4294966082}], length 0
13:10:46.639026 IP 192.168.1.212.62370 > 172.67.182.196.443: UDP, length 1200
13:10:46.683569 IP 192.168.1.212.62205 > 104.21.32.39.443: UDP, length 1200
13:10:47.137805 IP 192.168.1.212.58450 > 17.57.146.137.5223: Flags [P.], seq 3454293082:3454293122, ack 2352057687, win 2048, options [nop,nop,TS val 3904565196 ecr 2802185444], length 40
13:10:47.202604 IP 17.57.146.137.5223 > 192.168.1.212.58450: Flags [P.], seq 1:25, ack 40, win 249, options [nop,nop,TS val 2802304217 ecr 3904565196], length 24
13:10:47.260495 IP 192.168.1.212.62370 > 172.67.182.196.443: UDP, length 1200
13:10:47.262722 IP 192.168.1.212.58450 > 17.57.146.137.5223: Flags [.], ack 25, win 2047, options [nop,nop,TS val 3904565324 ecr 2802304217], length 0
13:10:47.449518 IP 192.168.1.212.62205 > 104.21.32.39.443: UDP, length 1200
13:10:48.489317 IP 192.168.1.212.58477 > 172.67.182.196.443: Flags [S], seq 4185428983, win 65535, options [mss 1460,nop,wscale 6,nop,nop,TS val 2696870742 ecr 0,sackOK,eol], length 0
13:10:48.497847 IP 192.168.1.212.62370 > 172.67.182.196.443: UDP, length 1200
13:10:48.551930 IP 172.67.182.196.443 > 192.168.1.212.58477: Flags [S.], seq 1801834925, ack 4185428984, win 65535, options [mss 1339,sackOK,TS val 1732272423 ecr 2696870742,nop,wscale 13], length 0
13:10:48.738249 IP 192.168.1.212.61310 > 17.250.84.140.443: UDP, length 41
13:10:48.741128 IP 192.168.1.212.58477 > 172.67.182.196.443: Flags [.], ack 1, win 2052, options [nop,nop,TS val 2696871007 ecr 1732272423], length 0
13:10:48.741187 IP 192.168.1.212.58477 > 172.67.182.196.443: Flags [P.], seq 1:518, ack 1, win 2052, options [nop,nop,TS val 2696871007 ecr 1732272423], length 517
13:10:48.793645 IP 17.250.84.140.443 > 192.168.1.212.61310: UDP, length 31
13:10:48.817958 IP 172.67.182.196.443 > 192.168.1.212.58477: Flags [F.], seq 4294965970:4294966082, ack 518, win 32120, length 112
13:10:48.820722 IP 192.168.1.212.58477 > 172.67.182.196.443: Flags [.], ack 1, win 2052, options [nop,nop,TS val 2696871087 ecr 1732272423,nop,nop,sack 1 {4294965970:4294966082}], length 0
13:10:48.973105 IP 192.168.1.212.62205 > 104.21.32.39.443: UDP, length 1200
13:10:50.986675 IP 192.168.1.212.62370 > 172.67.182.196.443: UDP, length 1200
13:10:51.547068 IP 104.21.32.39.443 > 192.168.1.212.58476: Flags [R], seq 160098442, win 32120, length 0
13:10:51.841575 IP 192.168.1.212.61310 > 17.250.84.140.443: UDP, length 41
13:10:51.904760 IP 17.250.84.140.443 > 192.168.1.212.61310: UDP, length 33
13:10:52.019168 IP 192.168.1.212.62205 > 104.21.32.39.443: UDP, length 1200
13:10:53.814070 IP 172.67.182.196.443 > 192.168.1.212.58477: Flags [R], seq 1801834926, win 32120, length 0
13:10:55.959451 IP 192.168.1.212.62370 > 172.67.182.196.443: UDP, length 1200
13:10:58.109401 IP 192.168.1.212.62205 > 104.21.32.39.443: UDP, length 
```

**Comment by Qeeckleeero** [comment]
И развернутая версия
```
13:14:52.926100 IP (tos 0x2,ECT(0), ttl 64, id 0, offset 0, flags [DF], proto UDP (17), length 1228)
    192.168.1.212.62218 > 104.21.32.39.443: [udp sum ok] UDP, length 1200
13:14:53.138188 IP (tos 0x2,ECT(0), ttl 64, id 0, offset 0, flags [DF], proto UDP (17), length 1228)
    192.168.1.212.62218 > 104.21.32.39.443: [udp sum ok] UDP, length 1200
13:14:53.150431 IP (tos 0x2,ECT(0), ttl 64, id 0, offset 0, flags [DF], proto UDP (17), length 1228)
    192.168.1.212.49444 > 172.67.182.196.443: [udp sum ok] UDP, length 1200
13:14:53.211716 IP (tos 0x0, ttl 64, id 0, offset 0, flags [DF], proto TCP (6), length 64)
    192.168.1.212.58479 > 104.21.32.39.443: Flags [S], cksum 0xae7f (correct), seq 1395299052, win 65535, options [mss 1460,nop,wscale 6,nop,nop,TS val 2454380343 ecr 0,sackOK,eol], length 0
13:14:53.282880 IP (tos 0x28, ttl 49, id 0, offset 0, flags [DF], proto TCP (6), length 60)
    104.21.32.39.443 > 192.168.1.212.58479: Flags [S.], cksum 0x6493 (correct), seq 3828062119, ack 1395299053, win 65535, options [mss 1339,sackOK,TS val 3836213974 ecr 2454380343,nop,wscale 13], length 0
13:14:53.341200 IP (tos 0x0, ttl 64, id 0, offset 0, flags [DF], proto TCP (6), length 52)
    192.168.1.212.58479 > 104.21.32.39.443: Flags [.], cksum 0x8a67 (correct), seq 1, ack 1, win 2052, options [nop,nop,TS val 2454380472 ecr 3836213974], length 0
13:14:53.341201 IP (tos 0x0, ttl 64, id 0, offset 0, flags [DF], proto TCP (6), length 569)
    192.168.1.212.58479 > 104.21.32.39.443: Flags [P.], cksum 0x76dc (correct), seq 1:518, ack 1, win 2052, options [nop,nop,TS val 2454380472 ecr 3836213974], length 517
13:14:53.428667 IP (tos 0x0, ttl 49, id 46528, offset 0, flags [DF], proto TCP (6), length 152)
    104.21.32.39.443 > 192.168.1.212.58479: Flags [F.], cksum 0x42d8 (correct), seq 4294965970:4294966082, ack 518, win 32120, length 112
13:14:53.457211 IP (tos 0x0, ttl 64, id 0, offset 0, flags [DF], proto TCP (6), length 64)
    192.168.1.212.58479 > 104.21.32.39.443: Flags [.], cksum 0x641c (correct), seq 518, ack 1, win 2052, options [nop,nop,TS val 2454380588 ecr 3836213974,nop,nop,sack 1 {4294965970:4294966082}], length 0
13:14:53.504854 IP (tos 0x2,ECT(0), ttl 64, id 0, offset 0, flags [DF], proto UDP (17), length 1228)
    192.168.1.212.49444 > 172.67.182.196.443: [udp sum ok] UDP, length 1200
13:14:53.528253 IP (tos 0x2,ECT(0), ttl 64, id 0, offset 0, flags [DF], proto UDP (17), length 1228)
    192.168.1.212.62218 > 104.21.32.39.443: [udp sum ok] UDP, length 1200
13:14:54.191864 IP (tos 0x2,ECT(0), ttl 64, id 0, offset 0, flags [DF], proto UDP (17), length 1228)
    192.168.1.212.49444 > 172.67.182.196.443: [udp sum ok] UDP, length 1200
13:14:54.354240 IP (tos 0x2,ECT(0), ttl 64, id 0, offset 0, flags [DF], proto UDP (17), length 1228)
    192.168.1.212.62218 > 104.21.32.39.443: [udp sum ok] UDP, length 1200
13:14:55.349544 IP (tos 0x0, ttl 64, id 0, offset 0, flags [DF], proto TCP (6), length 64)
    192.168.1.212.58480 > 172.67.182.196.443: Flags [S], cksum 0xb9ff (correct), seq 2475896168, win 65535, options [mss 1460,nop,wscale 6,nop,nop,TS val 633899656 ecr 0,sackOK,eol], length 0
13:14:55.424908 IP (tos 0x28, ttl 51, id 0, offset 0, flags [DF], proto TCP (6), length 60)
    172.67.182.196.443 > 192.168.1.212.58480: Flags [S.], cksum 0xf0be (correct), seq 2567067744, ack 2475896169, win 65535, options [mss 1339,sackOK,TS val 2438485995 ecr 633899656,nop,wscale 13], length 0
13:14:55.529301 IP (tos 0x0, ttl 64, id 0, offset 0, flags [DF], proto TCP (6), length 52)
    192.168.1.212.58480 > 172.67.182.196.443: Flags [.], cksum 0x165f (correct), seq 1, ack 1, win 2052, options [nop,nop,TS val 633899837 ecr 2438485995], length 0
13:14:55.529302 IP (tos 0x0, ttl 64, id 0, offset 0, flags [DF], proto TCP (6), length 569)
    192.168.1.212.58480 > 172.67.182.196.443: Flags [P.], cksum 0xf052 (correct), seq 1:518, ack 1, win 2052, options [nop,nop,TS val 633899837 ecr 2438485995], length 517
13:14:55.589689 IP (tos 0x0, ttl 51, id 37812, offset 0, flags [DF], proto TCP (6), length 152)
    172.67.182.196.443 > 192.168.1.212.58480: Flags [F.], cksum 0x1797 (correct), seq 4294965970:4294966082, ack 518, win 32120, length 112
13:14:55.590949 IP (tos 0x2,ECT(0), ttl 64, id 0, offset 0, flags [DF], proto UDP (17), length 1228)
    192.168.1.212.49444 > 172.67.182.196.443: [udp sum ok] UDP, length 1200
13:14:55.592228 IP (tos 0x0, ttl 64, id 0, offset 0, flags [DF], proto TCP (6), length 64)
    192.168.1.212.58480 > 172.67.182.196.443: Flags [.], cksum 0x0529 (correct), seq 518, ack 1, win 2052, options [nop,nop,TS val 633899901 ecr 2438485995,nop,nop,sack 1 {4294965970:4294966082}], length 0
13:14:55.933077 IP (tos 0x2,ECT(0), ttl 64, id 0, offset 0, flags [DF], proto UDP (17), length 1228)
    192.168.1.212.62218 > 104.21.32.39.443: [udp sum ok] UDP, length 1200
13:14:57.630884 ARP, Ethernet (len 6), IPv4 (len 4), Request who-has kndrt41r1.lan tell 192.168.1.212, length 28
13:14:57.631027 ARP, Ethernet (len 6), IPv4 (len 4), Reply kndrt41r1.lan is-at 0c:ef:af:d3:93:05 (oui Unknown), length 28
13:14:58.308033 IP (tos 0x2,ECT(0), ttl 64, id 0, offset 0, flags [DF], proto UDP (17), length 1228)
    192.168.1.212.49444 > 172.67.182.196.443: [udp sum ok] UDP, length 1200
13:14:58.428841 IP (tos 0x0, ttl 49, id 24454, offset 0, flags [DF], proto TCP (6), length 40)
    104.21.32.39.443 > 192.168.1.212.58479: Flags [R], cksum 0x85b0 (correct), seq 3828062120, win 32120, length 0
13:14:59.126790 IP (tos 0x2,ECT(0), ttl 64, id 0, offset 0, flags [DF], proto UDP (17), length 1228)
    192.168.1.212.62218 > 104.21.32.39.443: [udp sum ok] UDP, length 1200
13:15:00.598863 IP (tos 0x0, ttl 51, id 7713, offset 0, flags [DF], proto TCP (6), length 40)
    172.67.182.196.443 > 192.168.1.212.58480: Flags [R], cksum 0x3554 (correct), seq 2567067745, win 32120, length 0
13:15:03.808566 IP (tos 0x2,ECT(0), ttl 64, id 0, offset 0, flags [DF], proto UDP (17), length 1228)
    192.168.1.212.49444 > 172.67.182.196.443: [udp sum ok] UDP, length 1200
13:15:05.317172 IP (tos 0x28, ttl 51, id 56574, offset 0, flags [DF], proto TCP (6), length 76)
    sesto4-vip-bx-005.aaplimg.com.443 > 192.168.1.212.58478: Flags [P.], cksum 0x1b82 (correct), seq 947199901:947199925, ack 2807692740, win 128, options [nop,nop,TS val 2434237226 ecr 939229885], length 24
13:15:05.317292 IP (tos 0x28, ttl 51, id 56575, offset 0, flags [DF], proto TCP (6), length 52)
    sesto4-vip-bx-005.aaplimg.com.443 > 192.168.1.212.58478: Flags [F.], cksum 0xc788 (correct), seq 24, ack 1, win 128, options [nop,nop,TS val 2434237226 ecr 939229885], length 0
13:15:05.432912 IP (tos 0x0, ttl 64, id 0, offset 0, flags [DF], proto TCP (6), length 52)
    192.168.1.212.58478 > sesto4-vip-bx-005.aaplimg.com.443: Flags [.], cksum 0xfcf7 (correct), seq 1, ack 25, win 2047, options [nop,nop,TS val 939345357 ecr 2434237226], length 0
13:15:05.433953 IP (tos 0x0, ttl 64, id 0, offset 0, flags [DF], proto TCP (6), length 76)
    192.168.1.212.58478 > sesto4-vip-bx-005.aaplimg.com.443: Flags [P.], cksum 0x9f86 (correct), seq 1:25, ack 25, win 2048, options [nop,nop,TS val 939345357 ecr 2434237226], length 24
13:15:05.433954 IP (tos 0x0, ttl 64, id 0, offset 0, flags [DF], proto TCP (6), length 52)
    192.168.1.212.58478 > sesto4-vip-bx-005.aaplimg.com.443: Flags [F.], cksum 0xfcdb (correct), seq 25, ack 25, win 2048, options [nop,nop,TS val 939345359 ecr 2434237226], length 0
13:15:05.468635 IP (tos 0x28, ttl 51, id 56576, offset 0, flags [DF], proto TCP (6), length 52)
    sesto4-vip-bx-005.aaplimg.com.443 > 192.168.1.212.58478: Flags [F.], cksum 0xc6f2 (correct), seq 24, ack 1, win 128, options [nop,nop,TS val 2434237376 ecr 939229885], length 0
13:15:05.470670 IP (tos 0x0, ttl 64, id 0, offset 0, flags [DF], proto TCP (6), length 52)
    192.168.1.212.58478 > sesto4-vip-bx-005.aaplimg.com.443: Flags [F.], cksum 0xfcb7 (correct), seq 25, ack 25, win 2048, options [nop,nop,TS val 939345395 ecr 2434237226], length 0
13:15:05.480619 IP (tos 0x28, ttl 51, id 0, offset 0, flags [DF], proto TCP (6), length 40)
    sesto4-vip-bx-005.aaplimg.com.443 > 192.168.1.212.58478: Flags [R], cksum 0x7545 (correct), seq 947199926, win 0, length 0
13:15:05.486617 IP (tos 0x28, ttl 51, id 0, offset 0, flags [DF], proto TCP (6), length 40)
    sesto4-vip-bx-005.aaplimg.com.443 > 192.168.1.212.58478: Flags [R], cksum 0x7545 (correct), seq 947199926, win 0, length 0
13:15:05.507363 IP (tos 0x2,ECT(0), ttl 64, id 0, offset 0, flags [DF], proto UDP (17), length 1228)
    192.168.1.212.62218 > 104.21.32.39.443: [udp sum ok] UDP, length 1200
13:15:05.516918 IP (tos 0x28, ttl 51, id 0, offset 0, flags [DF], proto TCP (6), length 40)
    sesto4-vip-bx-005.aaplimg.com.443 > 192.168.1.212.58478: Flags [R], cksum 0x7545 (correct), seq 947199926, win 0, length 0
13:15:08.841949 IP (tos 0x0, ttl 64, id 0, offset 0, flags [DF], proto UDP (17), length 69)
    192.168.1.212.61310 > 17.250.84.140.443: [udp sum ok] UDP, length 41
13:15:08.914534 IP (tos 0x28, ttl 43, id 3847, offset 0, flags [DF], proto UDP (17), length 61)
    17.250.84.140.443 > 192.168.1.212.61310: [udp sum ok] UDP, length 33
13:15:10.069471 IP (tos 0x0, ttl 64, id 0, offset 0, flags [DF], proto UDP (17), length 69)
    192.168.1.212.61310 > 17.250.84.140.443: [udp sum ok] UDP, length 41
13:15:10.121604 IP (tos 0x28, ttl 48, id 0, offset 0, flags [DF], proto UDP (17), length 59)
    17.250.84.140.443 > 192.168.1.212.61310: [udp sum ok] UDP, length 31
13:15:14.776088 IP (tos 0x2,ECT(0), ttl 64, id 0, offset 0, flags [DF], proto UDP (17), length 1228)
    192.168.1.212.49444 > 172.67.182.196.443: [udp sum ok] UDP, length 1200
13:15:18.268098 IP (tos 0x2,ECT(0), ttl 64, id 0, offset 0, flags [DF], proto UDP (17), length 1228)
    192.168.1.212.62218 > 104.21.32.39.443: [udp sum ok] UDP, length 1200
13:15:29.015028 IP (tos 0x0, ttl 64, id 0, offset 0, flags [DF], proto UDP (17), length 69)
    192.168.1.212.61310 > 17.250.84.140.443: [udp sum ok] UDP, length 41
13:15:29.072249 IP (tos 0x28, ttl 43, id 14297, offset 0, flags [DF], proto UDP (17), length 61)
    17.250.84.140.443 > 192.168.1.212.61310: [udp sum ok] UDP, length 33
13:15:30.131508 IP (tos 0x0, ttl 64, id 0, offset 0, flags [DF], proto UDP (17), length 69)
    192.168.1.212.61310 > 17.250.84.140.443: [udp sum ok] UDP, length 41
13:15:30.173232 IP (tos 0x28, ttl 48, id 0, offset 0, flags [DF], proto UDP (17), length 59)
    17.250.84.140.443 > 192.168.1.212.61310: [udp sum ok] UDP, length 31
13:15:34.073085 ARP, Ethernet (len 6), IPv4 (len 4), Request who-has 192.168.1.212 tell kndrt41r1.lan, length 28
13:15:34.096518 ARP, Ethernet (len 6), IPv4 (len 4), Reply 192.168.1.212 is-at 72:ae:d8:d5:0e:82 (oui Unknown), length 28
13:15:49.084838 IP (tos 0x0, ttl 64, id 0, offset 0, flags [DF], proto UDP (17), length 69)
    192.168.1.212.61310 > 17.250.84.140.443: [udp sum ok] UDP, length 41
13:15:49.134400 IP (tos 0x28, ttl 43, id 24553, offset 0, flags [DF], proto UDP (17), length 61)
    17.250.84.140.443 > 192.168.1.212.61310: [udp sum ok] UDP, length 33
13:15:50.181420 IP (tos 0x0, ttl 64, id 0, offset 0, flags [DF], proto UDP (17), length 69)
    192.168.1.212.61310 > 17.250.84.140.443: [udp sum ok] UDP, length 41
13:15:50.242331 IP (tos 0x28, ttl 48, id 0, offset 0, flags [DF], proto UDP (17), length 60)
    17.250.84.140.443 > 192.168.1.212.61310: [udp sum ok] UDP, length 32
13:15:50.
```

**Comment by Qeeckleeero** [comment]
Так-с, и чо с этим делать?

**Comment by Qeeckleeero** [comment]
Перенастраивать br-lan?

**Comment by bol-van** [comment]
--debug лог смотреть nfqws/tpws

**Comment by Qeeckleeero** [comment]
Я все это время смотрел ap1001, теперь решил сделать то же самое с br-lan. (скину файлами, сорри)

[tcpcheckiphone.txt](https://github.com/user-attachments/files/18905145/tcpcheckiphone.txt)
[tcpcheckiphone1.txt](https://github.com/user-attachments/files/18905148/tcpcheckiphone1.txt)
[tcpcheckiphone2.txt](https://github.com/user-attachments/files/18905146/tcpcheckiphone2.txt)
[tcpcheckiphone3.txt](https://github.com/user-attachments/files/18905147/tcpcheckiphone3.txt)

**Comment by Qeeckleeero** [comment]
> --debug лог смотреть nfqws/tpws

Демон работает с debug'ом, но syslog молчит, попытался позаходить на сайты, все равно ничего

**Comment by bol-van** [comment]
См доку по ключу --debug
По умолчанию лог в консоль

**Comment by Qeeckleeero** [comment]
> --debug лог смотреть nfqws/tpws

[log.txt](https://github.com/user-attachments/files/18905581/log.txt)
На вайфае не только я, так что много мусора, но на рутрекер заходил только телефон

**Comment by Qeeckleeero** [comment]
Может профили все отключить и по одному включать?

**Comment by bol-van** [comment]
nfqws отрабатывает, но в логе tcpdump этого не видно
может он снимался при выключенном ?
лучше всего cap файл сразу заслать, текст далеко не все показывает

**Comment by Qeeckleeero** [comment]
Все снималось в одинаковых условиях, помимо добавления дебага запрет не выключался ни разу, к тому же когда снимал log у меня все равно на сайт не зашел.

На счет cap'а, чем его снимать? И с чего?

**Comment by bol-van** [comment]
Причина может быть банальна. Старый ios без поддержки TLS 1.3.
А tls1.2 и quic не обходятся выбранной стратегией

tcpdump -i wan -w /tmp/wan.cap

**Comment by Qeeckleeero** [comment]
> Причина может быть банальна. Старый ios без поддержки TLS 1.3.

У меня последний iOS 

> tcpdump -i wan -w /tmp/wan.cap

Точно wan чекать? У меня нет оптоволокна, наверное br-lan все-таки

**Comment by bol-van** [comment]
nfqws отрабатывает на внешнем интерфейсе, в бр-лан никак не отразятся его действия

**Comment by Qeeckleeero** [comment]
File type not allowed: .cap

**Comment by Qeeckleeero** [comment]
Загружу в репо и скину

**Comment by Qeeckleeero** [comment]
https://github.com/[Qeeckleeero/for_testing_purposes](https://github.com/Qeeckleeero/for_testing_purposes)

**Comment by Qeeckleeero** [comment]
Загрузил еще any, проверил все остальное (wwan0, wan, lo) -- нигде ничего нет

**Comment by Qeeckleeero** [comment]
Я идиот. Все на wwan0 есть, загрузил

**Comment by bol-van** [comment]
wan имелось в виду тот порт, что смотрит в инет

**Comment by Qeeckleeero** [comment]
> Вообщем QUIC глухо, TLS 1.0-1.3 стратегия не обходит
> На TLS приходит ответ DPI HTTP
> 
> HTTP/1.1 307 Temporary Redirect 
> Via: 1.0 middlebox
> Location: http://forbidden.yota.ru/
> Connection: close
> 
> Здесь надо смотреть IP block tests. Может по IP+протокол идет отлуп
> Блокчек прогнать на рутракер и еще какой-нибудь сайт вне cloudflare заблокированный. bbc.com 


Так в этом и прикол, на компе ведь все работает

**Comment by bol-van** [comment]
Тогда надо смотреть 2 дампа с компа и с яблофона и сравнивать

**Comment by Qeeckleeero** [comment]
> На компе может быть кибер
> Попробуйте отключить кибер в броузере на компе 

Кибер это quic?

**Comment by Qeeckleeero** [comment]
> На компе может быть кибер
> Попробуйте отключить кибер в броузере на компе 

Кибер это quic?

**Comment by Qeeckleeero** [comment]
Загрузил .cap для пк и для ипхона
На пк quic включенный, ща сделаю с выключенным

**Comment by bol-van** [comment]
Нет, kyber это постквантовая криптография, раздувающая client hello на 2 tcp пакета

**Comment by bol-van** [comment]
В вариант PC нет сеанса к rutracker. Сравнивать надо один домен
В PC версии кибер есть, в ios нет

**Comment by Qeeckleeero** [comment]
> В вариант PC нет сеанса к rutracker. Сравнивать надо один домен

Я подключался к Рутрекеру, может ошибка какая-то, сейчас переделаю

> В PC версии кибер есть, в ios нет

Как отключить?

**Comment by bol-van** [comment]
Погуглить как. Зависит от броузера

**Comment by Qeeckleeero** [comment]
> Погуглить как. Зависит от броузера
> 
> Сеанс к рутрекеру мог быть закэширован. tcp соединение могло быть заснято не с начала.
> Надо убивать броузер , запускать, включать дамп, заходить, выключать дамп

Понял, сделаем

**Comment by bol-van** [comment]
Вот и ответ. Кибер пробивает. На иос кибера нет.
Влияет ли как-то zapret на пробитие надо проверять.
И искать другую стратегию, которая пробьет без кибера. Блокчек проверяет курлом, который не умеет кибер

**Comment by Qeeckleeero** [comment]
> Надо пробовать fakedsplit/fakeddisorder.

Если ни то, ни другое не помогло с этим можно что-то сделать?

**Comment by bol-van** [comment]
Если blockcheck ничего не может найти, то тут только более сложные варианты вручную придумывать.
Я этим заниматься не буду

**Comment by DmitriyGo7** [comment]
У меня то же самое - на Windows пашет Ютуб, на iOS 15 нет.

**Comment by Qeeckleeero** [comment]
> У меня то же самое - на Windows пашет Ютуб, на iOS 15 нет.

В итоге это и правда оказался kyber, его на iOS никак не добавить, по крайней мере я не нашел способа

**Comment by Qeeckleeero** [comment]
> > У меня то же самое - на Windows пашет Ютуб, на iOS 15 нет.
> 
> В итоге это и правда оказался kyber, его на iOS никак не добавить, по крайней мере я не нашел способа
> 
> 

Если при проверке работает только на устройствах виндовс -- kyber
