### DISCUSSION TITLE
Отвал mega.nz

### DISCUSSION THREAD

**Discussion by z0mb1e-kgd** [bol-van/zapret#1813] [General]
С пару дней назад отвалась синхронизация с mega.nz, Megasync висит в трее c кружком. Дело привычное, запустил блокчек - вообще ничего. По многу часов перебирает, в итоге - ни одного пробива. На блок по IP не похоже, пинги ходят, и nc -z -w 2 31.216.144.5 443 коннектится, но курл ругается на BADCERT_CN_MISMATCH, ncat при -vvv --ssl-verify пишет:
```
NCAT DEBUG: Checking certificate DNS name "mega.nz" against "31.216.144.5".
NCAT DEBUG: Checking certificate DNS name "www.mega.nz" against "31.216.144.5".
Ncat: Certificate verification error. QUITTING.
```
Блокчек при подборе выдает либо таймаут 28, либо ошибку соединения 35.
В браузере при попытке соединения через прокси-расширение Censor Tracker загружаются несколько ресурсов с mega.nz по TLS 1.3 (картинка с облаком и логотипом Mega), дальше соединение до eu.static.mega.co.nz и g.api.mega.co.nz либо сбрасывается, либо не проходит проверку CORS, без расширения - таймаут.

Запрет последней версии, на роутере настроен DoH.

Куда копать (кроме как сходить на три веселых буквы)?

**Comment by ghost** [comment]
> BADCERT_CN_MISMATCH

возможно, фейк доходит до сервера. может быть в том случае, если используется фулинг (без ttl), который не подходит
посмотри варианты с 35, там какой вариант с фулингом/ttl используется?

**Reply by z0mb1e-kgd** [reply]
Доходить-то доходит, но сервер меги сбрасывает соединение на этапе TLS-рукопожатия.

**Comment by HentayHentay** [comment]
> Куда копать

Предоставленной информации не достаточно для "копания"
Судя по всему либо проблемы со стратегией, либо переизбыток

**Reply by z0mb1e-kgd** [reply]
С какой стратегией? Пишу ж, ни одна из стратегий из blockcheck.sh, со всей своей вариативностью, не пробивает блокировку. Единственное - есть несколько успешных вариантов пробива по 80 порту, но незашифрованные соединения mega.nz не использует (как и 99 % интернет-ресурсов на сегодняшний день), редиректит на 443. А 443 зависает на этапе TLS-хэндшейка.

И какой информации недостаточно? Вроде подробно всё описал.

**Comment by z0mb1e-kgd** [comment]
О. Пробил. Вытащил из прошлых рабочих стратегий:
```
--filter-tcp=443 --hostlist=/opt/mega.txt
--dpi-desync=fake,multidisorder
--dpi-desync-split-pos=1,midsld
--dpi-desync-fooling=badsum
--dpi-desync-fake-tls-mod=rnd,dupsid,sni=www.google.com
--dpi-desync-repeats=11
```
Содержание /opt/mega.txt:
```
mega.nz
mega.co.nz
```
Странно только, что blockcheck не выявил такого варианта.

Но работает только в браузере. Megasync пока не синхронизирует. Megasync пытается подключиться к bt3.api.mega.co.nz, bt1.api.mega.co.nz по 443 порту, one.one.one.one. 66.203.125.12, 66.203.125.13, 66.203.125.14, 66.203.125.15. В Wireshark по этим адресам примерно следующее:
```
2570	119.691065	192.168.10.23	66.203.125.15	TLSv1.2	222	Client Hello
2571	119.726815	66.203.125.15	192.168.10.23	TCP	60	443 → 59864 [ACK] Seq=1 Ack=169 Win=43008 Len=0
2712	131.692113	192.168.10.23	66.203.125.15	TLSv1.2	61	Alert (Level: Warning, Description: Close Notify)
2713	131.692447	192.168.10.23	66.203.125.15	TCP	54	59864 → 443 [FIN, ACK] Seq=176 Ack=1 Win=262656 Len=0
2714	131.956769	192.168.10.23	66.203.125.15	TCP	61	[TCP Retransmission] 59864 → 443 [FIN, PSH, ACK] Seq=169 Ack=1 Win=262656 Len=7
(повтор несколько раз)
2951	150.913889	192.168.10.23	66.203.125.15	TCP	54	59864 → 443 [RST, ACK] Seq=177 Ack=1 Win=0 Len=0 
```
Буду ковырять дальше.

**Reply by sam0x2b** [reply]
одинацеть репитав... у вас так trunk ляжет 🤣

**Reply by oniksofers** [reply]
Столкнулся с похожей проблемой когда с нуля писал стратегии. Приложении меги использует кроме tcp, еще QUIC поэтому нужно также дурение udp 443

**Comment by oniksofers** [comment]
У меня без хостилистов, мега пробивалась самыми обычными стратегиями. С хостлистами было посложнее, потому что есть вот такие адреса
mcd270n314.karere.mega.nz
mcd270n310.karere.mega.nz
mcd270n313.karere.mega.nz
xmpp270n003.karere.mega.nz
trn270n001.karere.mega.nz
trn270n002.karere.mega.nz
без них ничего не работает, вероятно есть еще такого рода, но беглый поиск выдал только такие.

**Reply by z0mb1e-kgd** [reply]
Вопрос, нужно ли указывать все эти субдомены, если zapret автоматически обрабатывает субдомены в хостлистах, и mega.nz в этом случае было бы достаточно. Другое дело, что одни субдомены могут пробиваться по одной стратегии, а другие - по другой (например, не принимать дурение, прописанное в первой стратегии), тогда в этом может быть смысл. Нужно тестировать каждый субдомен отдельно. Займусь.

**Reply by oniksofers** [reply]
Вероятно не нужно, проблема вроде была в том, что win бандл был залит кривой, как писал Болван, он его поправил. С новым вин бандлом основных доменов хватает.

**Comment by mrTerryBogard** [comment]
Есть информация в комментариях на [dtf.ru](https://dtf.ru/id543165/4103466-kazhetsya-failoobmenik-mega-zakryli-dlya-rossii), но она не подтверждена, что дело рук РКН.

**Reply by oniksofers** [reply]
Да не, быть такого не может :D

**Comment by oniksofers** [comment]
На моем провайдере мегу разбанили

**Reply by EIKAInc** [reply]
Или она сама пошла по альтернативным сетям, что не ознает, что ее разбанили (пока ни на наких моих провах ее не разбанили).

**Reply by oniksofers** [reply]
Ваша правда, хотя само приложение логинится без запрета, синхронизироваться оно перестало, так что увы. Также пришло письмо от меги, что они в курсе ситуации, но их совет, мол пишите в спортлото( в ркн)

**Reply by EIKAInc** [reply]
Добиться логина легко, я подкинул всего 1 сетку, которую сначала забанил РКН. Оно поработало пару дней, а потом умерло. Сегодня я отснифал активность exe и нашел пару сеточек еще, в том числе один ASN не Мега, а Akmai, и оно полетело. Список сетей: https://github.com/bol-van/zapret/discussions/1813#discussioncomment-14952919

**Reply by oniksofers** [reply]
Я просто добавил хостлист список доменов которые откопал, но так как я мск области, блокировка cdn у меня только по праздникам, поэтому мб и хватает.

**Reply by EIKAInc** [reply]
По доменам там кроме mega.* есть еще и *.ip.dclux.com, и он нужен. А вот acroipm2.adobe.com тоже есть, причем десятки обращений, а он не нужен. Скорее всего вы правы, у вас может 1 сеточка попала в список ТСПУ и вы легко обошли, а я на 2 провах уже третий день собираю сетки, и раз в сутки Мега подкидывает новую и новую сеточку. Сам сервис не публикует официальных списков сетей, а зря (кинул им идею на реализацию).

**Reply by oniksofers** [reply]
Что-то когда этим занимался *.ip.dclux.com не видел. Но на всякий случай запишу. Ну у меня провайдер корпоративный и каких-то особых зверств не наблюдал. Правда когда тестили 16кб блок по всей стране, тоже задело.

**Reply by EIKAInc** [reply]
Без разницы какой провайдер. Вопрос - чьи у него ТСПУ, свои или аренда. Если заметят нарушение, фейсы и РКН нарисуют им штрафов. У нас у самих есть провайдер, за ТСПУ платим аренду. Один раз приходили уже.

**Comment by Neovolter** [comment]
Благодарю за домены! После того как добавил их в список Запрета теперь снова нормально качает с Меги а то до этого были постоянно таймауты

**Reply by sorockinalexrzn** [reply]
Здравствуйте! Сегодня обнаружил, что мега прекратила синхронизироваться, а я её использую на нескольких компьютерах для синхронизации проектов. Попытался открыть файл image выше, но он недоступен. У меня винда. Что где прописать надо? Подскажите пожалуйста... byedpi не помогает, туннелирование ipv6 через ipv4 на роутере сделано, тоже не помогает

**Reply by sorockinalexrzn** [reply]
P/S/ Где-то прочитал, что надо отключить HTTPS в настройках-сеть-имзменить настройки - внизу калочка "Использовать HTTPS" - надо убрать галочку. Все заработало.

**Comment by EIKAInc** [comment]
@z0mb1e-kgd

Поснифайте, там нужно побольше сеточек. И что-то еще добавляли недавно, или Мега сама умеет искать альтернативные новые пути. При таком списке роутинга в обход, удалось вновь запустить Мегу:

```
2.19.196.0/22
31.216.145.0/24
31.216.148.0/24
66.203.125.0/24
66.203.126.0/23
69.30.89.0/24
82.21.172.0/24
82.29.203.0/24
82.29.204.0/22
89.44.168.0/25
89.44.169.0/24
94.24.36.0/23
162.208.16.0/24
185.206.24.0/22
```

Это полный, или почти полный список ее сетей по всему миру.

Кстати, зачем-то MegaSync.exe долбится вот сюда: acroipm2.adobe.com. Однако, это какая-то дичь, поди рекламная? При забаненном acroipm2.adobe.com в hosts, все работает.

P.S.
Переход на http ничего не давал, дело именно в фильтрации сетей на ТСПУ.

**Reply by EIKAInc** [reply]
Список обновляю уже 1.5 недели, так как клиент Мега расползается по новым и новым ASNкам. Может быть он так работает, а может быть так обходит блокировки по воле разрабов.

**Reply by elistratov-gv** [reply]
Доброго времени суток!
Просьба, что нужно сделать для для восстановлении работоспособности megasync в Windows 10? Что делать опубликованными IP подсетями?

**Reply by EIKAInc** [reply]
Прописать в любой VPN для обхода. Если не знаете как это делать, найдите того кто это сделает вам за деньги, например, на Авито.

**Reply by HentayHentay** [reply]
> сделает вам за деньги, например, на Авито.

Хороший совет.  "Как повесить себе на грудь мишень".

**Reply by EIKAInc** [reply]
Выздоравливайте.

**Reply by EIKAInc** [reply]
Обновил список еще раз, так как добавились новые сети. Заодно сделал merge, и CIDRов стало наоборот меньше при большем количестве сетей.
