### DISCUSSION TITLE
новые фишки от DPI

### DISCUSSION THREAD

**Discussion by AlexTransit** [bol-van/zapret#1806] [General]
сегодня у меня начали испытывать новую методу. 
под раздучу попол клауд.
если курлом посмотреть на cloudflare.com то видно что идет ответ, а потом на рандомном месте "подвисает" 
не зависимо от того включена дурилка или нет. 
видимо дропают части ответа.  если поднять последний awg, то иногда получаю или отвал по тайм ауту или ошибку.
к дурилке это не имеет никакого отношения, 
но походу сейчас на нас обкатают, а через несколько недель/месяцев и других затронет. ( уже не первый раз такое. сначала у меня все падает, а через месяц другой, тут нашествие копипастеров с поиском таблетки )

**Comment by DimaXA97** [comment]
Тоже такая петрушка, частично отвалились ресурсы за CDN по 443 ТСР.
РТК

**Comment by Afreetx** [comment]
тоже самое. Если дискорд start и update проходит, то сам клиент просто черный квадрат.
~ # curl -I https://cdn.discordapp.com
HTTP/1.1 403 Forbidden

**Comment by HentayHentay** [comment]
Это не новые фишки DPI
Это просто кто-то плохо изучает тему "обхода"

**Comment by overloader7** [comment]
В blockcheck пропиши повтор теста 5-10 раз (параллельно у меня норм сработало), ставь стандартную проверку и попробуй несколько из результирующих стратегий (они сильно от сайта зависят). Мне это помогло.

**Reply by Afreetx** [reply]
уже и так и сяк  - 0 результата. Всё работает, кроме дискорда (с cloudflare никак договориться не получается: или tolong или dpi блочит или 403).

**Reply by AlexTransit** [reply]
> В blockcheck пропиши повтор теста 5-10 раз (параллельно у меня норм сработало),

:)))) повтор можно делать хоть 100 раз.
curl_test_https_tls12 ipv4 cloudflare.com : working without bypass
curl_test_https_tls12 ipv6 cloudflare.com : working without bypass

дурилка тут не причем.  дропят часть ответа. 

да ладно. обождите чуток, скоро и Вам внедрят новые фишки. можно и повторы теста увиличивать, и хорошенько изучить тему "обхода"  :)
позже гляну что там с пакетами происходит.

**Reply by sicutaviam** [reply]
наблюдается похожая история. При использовании различных видов дурения, соединение по сути идет вне зависимости от количества повторений. Без использования запрета при попытке подключения к discordapp.com Server Hello просто не приходит. При использовании запрета Server Hello приходит, после этого в лучшем случае несколько пакетов проходят, иногда даже удается что-то загрузить. Но потом в ответ просто не приходит ничего. Пока не понял, что с этим можно сделать, но блокчек тут по сути не особо помогает

**Reply by AlexTransit** [reply]
> Пока не понял, что с этим можно сделать, но блокчек тут по сути не особо помогает

да. если посмотреть на чистый трафик то ответ идет кусками без подтверждения.
а тут идет стандартное рукопожатие и часть трафика, который подтверждается асками. видимо посередине или меняют флаги или дропят, вот и идут в ответ аски.
а потом дропят все. и тут видел два варианта или прилетает ресет и может быть реинит или в ответ постоянный долгий тсп алив
короче начали модификачить естаблишет трафик.

**Comment by DimaXA97** [comment]
Вобщем, что получилось у меня:

Блокчек выдал такое (но ничего не заработало):

```
ipv4 discord.com curl_test_https_tls12 : nfqws --dpi-desync=multidisorder --dpi-desync-split-pos=1,sniext+1,host+1,midsld-2,midsld,midsld+2,endhost-1
ipv4 discord.com curl_test_https_tls12 : nfqws --dpi-desync=fake --dpi-desync-fooling=badseq --dpi-desync-fake-tls=0x00000000 --dpi-desync-fake-tls=! --dpi-desync-fake-tls-mod=rnd,rndsni,dupsid
ipv4 discord.com curl_test_https_tls12 : nfqws --dpi-desync=fake --dpi-desync-fooling=ts
ipv4 discord.com curl_test_https_tls12 : nfqws --dpi-desync=fake --dpi-desync-fooling=md5sig --dup=1 --dup-cutoff=n2 --dup-fooling=md5sig
ipv4 discord.com curl_test_https_tls12 : nfqws --dpi-desync=fakedsplit --dpi-desync-fooling=badseq --dpi-desync-split-pos=1
ipv4 discord.com curl_test_https_tls12 : nfqws --dpi-desync=fakedsplit --dpi-desync-fooling=ts --dpi-desync-split-pos=1
ipv4 discord.com curl_test_https_tls12 : nfqws --dpi-desync=fakedsplit --dpi-desync-fooling=md5sig --dup=1 --dup-cutoff=n2 --dup-fooling=md5sig --dpi-desync-split-pos=1
ipv4 discord.com curl_test_https_tls12 : nfqws --dpi-desync=fake,multisplit --dpi-desync-fooling=badseq --dpi-desync-split-pos=1 --dpi-desync-fake-tls=0x00000000 --dpi-desync-fake-tls=! --dpi-desync-fake-tls-mod=rnd,rndsni,dupsid
ipv4 discord.com curl_test_https_tls12 : nfqws --dpi-desync=fake,multisplit --dpi-desync-fooling=ts --dpi-desync-split-pos=1
ipv4 discord.com curl_test_https_tls12 : nfqws --dpi-desync=fake,multisplit --dpi-desync-fooling=md5sig --dup=1 --dup-cutoff=n2 --dup-fooling=md5sig --dpi-desync-split-pos=1
ipv4 discord.com curl_test_https_tls12 : nfqws --dpi-desync=fake,fakedsplit --dpi-desync-fooling=badseq --dpi-desync-split-pos=1 --dpi-desync-fake-tls=0x00000000
ipv4 discord.com curl_test_https_tls12 : nfqws --dpi-desync=fake,fakedsplit --dpi-desync-fooling=ts --dpi-desync-split-pos=1
ipv4 discord.com curl_test_https_tls12 : nfqws --dpi-desync=fake,fakedsplit --dpi-desync-fooling=md5sig --dup=1 --dup-cutoff=n2 --dup-fooling=md5sig --dpi-desync-split-pos=1
```

У меня самого до этого стояла "универсальная" на все:
`--filter-tcp=443 --dpi-desync=fake --dpi-desync-fake-tls=0x00000000 --dpi-desync-fake-quic=/root/zapret-v71.4/files/fake/quic_initial_www_google_com.bin --dpi-desync-fake-tls=/root/zapret-v71.4/files/fake/tls_clienthello_www_google_com.bin --dpi-desync-fooling=badsum --new`

Когда только началось, поправил badsum на ts и оно правда заработало на часик другой, а теперь совсем глухо. 
И действительно не работает только дискорд веб на 443, остальное работает.
Временно веб дискорда перекинул в забугорный туннель, что бы авторизация проходила, но в целом копать надо в сторону дурения не самого дискорда, а CDN, за которым он стоит

**Comment by AlexTransit** [comment]
вот как выглядит запрос `curl -4 --tlsv1.3 https://www.cloudflare.com`
судя по тому что прерывается в разном месте, количество входящих пакетов разное.

```
#No.	Time	Source	Destination	Protocol	Length	Info
21	2.693054	192.168.1.14	104.16.124.96	TCP	66	50226 → 443 [SYN] Seq=0 Win=65535 Len=0 MSS=1460 WS=256 SACK_PERM
22	2.726098	104.16.124.96	192.168.1.14	TCP	66	443 → 50226 [SYN, ACK] Seq=0 Ack=1 Win=65535 Len=0 MSS=1400 SACK_PERM WS=8192
23	2.726372	192.168.1.14	104.16.124.96	TCP	54	50226 → 443 [ACK] Seq=1 Ack=1 Win=65280 Len=0
24	2.733507	192.168.1.14	104.16.124.96	TLSv1.3	481	Client Hello (SNI=www.cloudflare.com)
25	2.768583	104.16.124.96	192.168.1.14	TCP	60	443 → 50226 [ACK] Seq=1 Ack=428 Win=131072 Len=0
26	2.791142	104.16.124.96	192.168.1.14	TLSv1.3	1506	Server Hello, Change Cipher Spec
27	2.791142	104.16.124.96	192.168.1.14	TCP	1506	443 → 50226 [ACK] Seq=1453 Ack=428 Win=131072 Len=1452 [TCP PDU reassembled in 28]
28	2.791142	104.16.124.96	192.168.1.14	TLSv1.3	302	Application Data
29	2.791260	192.168.1.14	104.16.124.96	TCP	54	50226 → 443 [ACK] Seq=428 Ack=3153 Win=65280 Len=0
30	2.794589	192.168.1.14	104.16.124.96	TLSv1.3	134	Change Cipher Spec, Application Data
31	2.794723	192.168.1.14	104.16.124.96	TLSv1.3	158	Application Data
32	2.829396	104.16.124.96	192.168.1.14	TCP	60	443 → 50226 [ACK] Seq=3153 Ack=612 Win=131072 Len=0
33	3.413972	Routerboardc_ed:54:24	Nearest-Customer-Bridge	STP	60	RST. Root = 32768/0/64:d1:54:4c:ec:d2  Cost = 10  Port = 0x8004
34	3.489461	104.16.124.96	192.168.1.14	TLSv1.3	1506	Application Data
35	3.489461	104.16.124.96	192.168.1.14	TLSv1.3	475	Application Data
36	3.489585	192.168.1.14	104.16.124.96	TCP	54	50226 → 443 [ACK] Seq=612 Ack=5026 Win=65280 Len=0
37	3.489635	104.16.124.96	192.168.1.14	TLSv1.3	1506	Application Data
38	3.489635	104.16.124.96	192.168.1.14	TLSv1.3	1384	Application Data
39	3.489635	104.16.124.96	192.168.1.14	TLSv1.3	1506	Application Data
40	3.489635	104.16.124.96	192.168.1.14	TLSv1.3	1506	Application Data
41	3.489635	104.16.124.96	192.168.1.14	TLSv1.3	1323	Application Data
42	3.489635	104.16.124.96	192.168.1.14	TLSv1.3	1506	Application Data
43	3.489695	192.168.1.14	104.16.124.96	TCP	54	50226 → 443 [ACK] Seq=612 Ack=13433 Win=65280 Len=0
44	3.489715	104.16.124.96	192.168.1.14	TLSv1.3	1506	Application Data
45	3.489715	104.16.124.96	192.168.1.14	TLSv1.3	1506	Application Data
46	3.489715	104.16.124.96	192.168.1.14	TLSv1.3	1506	Application Data
47	3.489715	104.16.124.96	192.168.1.14	TLSv1.3	1506	Application Data
48	3.489715	104.16.124.96	192.168.1.14	TLSv1.3	1506	Application Data
49	3.489715	104.16.124.96	192.168.1.14	TLSv1.3	1506	Application Data
50	3.489765	192.168.1.14	104.16.124.96	TCP	54	50226 → 443 [ACK] Seq=612 Ack=22145 Win=65280 Len=0
51	3.489781	104.16.124.96	192.168.1.14	TLSv1.3	1506	Application Data
52	3.489781	104.16.124.96	192.168.1.14	TLSv1.3	1506	Application Data
53	3.489781	104.16.124.96	192.168.1.14	TLSv1.3	1506	Application Data
54	3.489781	104.16.124.96	192.168.1.14	TLSv1.3	835	Application Data
55	3.489820	192.168.1.14	104.16.124.96	TCP	54	50226 → 443 [ACK] Seq=612 Ack=27282 Win=65280 Len=0
56	3.489969	104.16.124.96	192.168.1.14	TLSv1.3	1506	Application Data
57	3.542418	192.168.1.14	104.16.124.96	TCP	54	50226 → 443 [ACK] Seq=612 Ack=28734 Win=65280 Len=0

```

**Comment by johnnyd-78** [comment]
Этой "новой фишке" уже полгода минимум, если не больше. Называется блок после передачи 16КБ данных в сторону зарубежных хостеров.

**Reply by DimaXA97** [reply]
Фейками лечилось, разве нет?

**Comment by Gennady-G** [comment]
Так-то оффтоп но возможно относится к вашей теме..
Сегодня сдох клиент от файловой хранилки Mega, **MegaSync** (не только у меня а в части России). 

<img width="150" height="131" alt="2025-10-22_111325" src="https://github.com/user-attachments/assets/e9b15822-6bee-488a-ba04-c9d0ba0648ba" />

Пользуюсь DPI UI - не подскажете какие адреса можно добавить в конфигурацию, чтобы обход работал также для Меги? На данный в обёртке установлен zapret 72.2. Провайдер МГТС
Как минимум наверное банятся вот эти два:

> mega.co.nz
> g.api.mega.co.nz
>

**Reply by Observer250** [reply]
У меня работает MegaSync с этими адресами.

```bash
mega.nz     
mega.io        
g.api.mega.co.nz    
mega.co.nz          
g.static.mega.co.nz   
eu.static.mega.co.nz                     
api.mega.co.nz          
w.api.mega.co.nz        
s.api.mega.co.nz        
reqstat.api.co.nz       
static.mega.co.nz       
karere.mega.nz          
storage.mega.co.nz      
userstorage.mega.co.nz  
snapshot.mega.co.nz     
ucdn.mega.co.nz         
upd.mega.nz        
chat.mega.nz      
lu.api.mega.co.nz 
```

**Reply by Gennady-G** [reply]
**update:**:  p.s.: хотя нет.. Сегодня всё равно не коннектится. МГТС, юго-восток..

**update:** спасибо огромное ещё раз! Кароче до конца не понял что я сделал, видать обновил автонастройки - но в итоге частично заработало!)) По кр мере разок синхронизировалось.. оО

@Observer250 спасибо большое за ответ! А какой пресет?.. у меня с "YTDisBystro by KDS" (рекомендован по умолчанию) не взлетает..

**Comment by koli-hinokami** [comment]
<img width="990" height="694" alt="gitea киснет" src="https://github.com/user-attachments/assets/e9c6ff6a-2796-4997-a0e9-cdd380660a2d" />
<img width="990" height="684" alt="форум киснет" src="https://github.com/user-attachments/assets/e6c28b50-b591-42bf-b25b-d60733588583" />
Не знаю как у вас, а у меня всё плохо - вот что-что, а что накроет [Gitea](https://git.kolibrios.org/) и [форум](https://board.kolibrios.org/) Колибри я не ждал. Накрывает после 16 килобайт трафика, winws или без - неважно.
Причём по ssh на порту 222 git работает без проблем.

**Reply by fixator10** [reply]
Накрыло даже [динозавров](https://wiki.industrial-craft.net/index.php?title=Main_Page). Жить становится лучше, жить становится веселее

**Reply by koli-hinokami** [reply]
> Накрыло даже [динозавров](https://wiki.industrial-craft.net/index.php?title=Main_Page).

блиин. это уже не плохо. это ужаснейше. я без ic2 жить не могу. слава богу ещё помню как подымать агрикультуру ic2 и жидкостный реактор, иначе и про майнкрафт можно было бы забыть.

**Comment by ilidosha** [comment]
Помог способ с загрузкой Warp от cloudflare (1.1.1.1), discord youtube и в том числе сервера BF6 всё работать начало и пакеты больше не сбрасывает

**Reply by dymn** [reply]
А можно на пальцах объяснить что и как делать?

**Reply by AlexTransit** [reply]
> Помог способ с загрузкой Warp от cloudflare

:))) помог способ, когда трафик идет через VPN от клауда? 
так с дрогими VPN пока все работает, но.
vpn трафик, так же как и торовский - детектят. вдобавок vpn преимущественно идет по udp.
я уже сталкивался когда на точке блочат все, кроме udp53, tcp80 и tcp443 . и в этом случае ни один vpn не работает. :)
я написал про проблему с вебовским трафиком. а "рубануть"  udp и лишний ipsec - это будет следующий шаг, который реализовать, ну очень просто.

**Reply by DimaXA97** [reply]
Черкану апдейт:
Пока получилось обойти всю эту чепушню с мобилки, работает все - инста, ют, дс и еще пара сайтов за клаудфлером.
На ПК с браузера пока SSL_PROTOCOL_ERROR у дс и сайтов за CF, ют и инст работают.
Допиливайте и кидайте варианты

`--filter-tcp=443 --dpi-desync=fake --dpi-desync-fooling=badsum,ts  --dpi-desync-fake-tls=/root/zapret-v71.4/files/fake/tls_clienthello_www_google_com.bin --new`

Полный конфиг:
```
--filter-tcp=53,80 --dpi-desync=fake --dpi-desync-fake-tls=! --dpi-desync-repeats=5 --dpi-desync-fooling=md5sig --new
--filter-tcp=443 --dpi-desync=fake --dpi-desync-fooling=badsum,ts  --dpi-desync-fake-tls=/root/zapret-v71.4/files/fake/tls_clienthello_www_google_com.bin --new
--filter-udp=53,443 --dpi-desync=fake --dpi-desync-repeats=5 --dpi-desync-fake-quic=/opt/zapret/files/fake/quic_initial_www_google_com.bin --new
--filter-udp=450-65535 --dpi-desync=fake --dpi-desync-any-protocol --dpi-desync-repeats=12 --new"
```

**Reply by AlexTransit** [reply]
> Пока получилось обойти всю эту чепушню

Вам в другую тему. 
просто Вы пока еще не столкнулись с модификацией пакетов установленного соединения. 
так же непонятно зачем делать фейк на 53 порт? там все открытым текстом идет.  :))) dns запросы шифруются по другому.

**Reply by DimaXA97** [reply]
> зачем делать фейк на 53 порт? 

Это какое то легаси осталось, у меня в целом через DoH все это настроено)

Вчера как минимум столкнулся с 16кб, сейчас вроде уже нет такого. 
Тестики гоняют, поди.

**Reply by koli-hinokami** [reply]
> Вчера как минимум столкнулся с 16кб, сейчас вроде уже нет такого.

Слава богам у меня тоже сняли. Лучше уж пуленепробиваемая блокировка дискорда и ютуба, чем всего интернета.

**Reply by chipodrillo** [reply]
А может нас почучуть готовят к большой локальной сети?! =((

**Reply by johnceena0** [reply]
> Черкану апдейт: Пока получилось обойти всю эту чепушню с мобилки, работает все - инста, ют, дс и еще пара сайтов за клаудфлером. На ПК с браузера пока SSL_PROTOCOL_ERROR у дс и сайтов за CF, ют и инст работают. Допиливайте и кидайте варианты
> 
> `--filter-tcp=443 --dpi-desync=fake --dpi-desync-fooling=badsum,ts --dpi-desync-fake-tls=/root/zapret-v71.4/files/fake/tls_clienthello_www_google_com.bin --new`
> 
> Полный конфиг:
> 
> ```
> --filter-tcp=53,80 --dpi-desync=fake --dpi-desync-fake-tls=! --dpi-desync-repeats=5 --dpi-desync-fooling=md5sig --new
> --filter-tcp=443 --dpi-desync=fake --dpi-desync-fooling=badsum,ts  --dpi-desync-fake-tls=/root/zapret-v71.4/files/fake/tls_clienthello_www_google_com.bin --new
> --filter-udp=53,443 --dpi-desync=fake --dpi-desync-repeats=5 --dpi-desync-fake-quic=/opt/zapret/files/fake/quic_initial_www_google_com.bin --new
> --filter-udp=450-65535 --dpi-desync=fake --dpi-desync-any-protocol --dpi-desync-repeats=12 --new"
> ```

Спасибо мил человек, перестало рубать на 25 КБ как было до этого

**Comment by AlexTransit** [comment]
кто как, а я писал жалобу в роскомнадзор. потому что не работали "бытовые" сайты (типа theoldreader.com ).  и чем больше народ будет молчать тем сильнее затянут гайки.
я понимаю что письмо, и ответ от замдира роскомнадзора по моему региону наврадли повлияло, хотя как знать.

сейчас отрубули бабуйню, которая вмешивается в трафик с состоянием ESTABLISHED (некоторые думают что это проблема 16к, но нет никакой связи с 16к. :) иногда может быть после 16к, а бывает и сильно раньше :) )
итого: 
успешную блокировку UDP - делали ( у нас выборочно на некоторых BS (сотовые вышки) блочили UDP. провайдер говорил что ничего не делал, а за то что он ничего не делал, мне дали неплохой дисконт в оплате на несколько месяцев :) )
успешную блокировку TOR - делали
а теперь и обкатали ресурсно затратную блокировку вебсокетного трафика.

данную дискуссию закрываю.
